yll fc kakak indak takut data sebar uu pdp lho kalo bocor tuntut	negative
data duduk gampang bocor enggak usah dihack karyawannya tolol enggak punya logika manusiawi budaya baca ketik pamer hasil pikir otak khalayak	negative
anak bangsa anak bangsa data bpjs 279 juta warga bocor lu urus sat	negative
bocor data ktp jual belikan	negative
film2 data anggota intel diperjuangin tembak2an biar bocor hidup nyata tembak hoaks	negative
tau hapus data pribadi bocor sosmed hapus akun tipu rem banget cek fb 5 akun nama pakai nama pakai foto	negative
hahahah banget negara efek off jabat kali ya bobrok data bocor bbm	negative
bbm data bocor pergi2 scan apps mending pelihara burung puter warna isi rumah tarik adopsi same day httpstcoafciikmaozpuan next president	negative
maenmaen kali data presiden bocor gaes lupa bocor data bpjs tokopedia data sih	negative
wes lamax2 data ibux2 posyandu bocor	negative
data lokal bocor menyalahkan google	negative
penasaran banget pinjol2 kayak gin data kalo tf rekening orang nagih nya nomer ybs kalo kayak arti data bocor	negative
data pribadi rawan bocor seringsering update knowledge aman	negative
kena data nasabah leasing bocor eksternal halus dc alias mata elang kang asep tau kalo aplikasi samsat data pajak ya tau kalo nyata nama alamat milik cmiiw	negative
datadata jabat bocor kali ya cek slik idscore nya ken lihat riwayat hutang	negative
26 juta data langgan indihome duga bocor tindak kominfo	negative
bocor ra becus opo masalahe data iso dadi duit wkwkwkwkwk	negative
investigasi duga data bocor hasil telusur pln	negative
nya isu aman data pribadi salah utama era digitalisasi banget isu data pribadi bocor rem ya	negative
data cakap bocor publikasi httpstcow1dijyekni	negative
data registrasi prabayar bocor menyalahkan boomer data tokopedia bocor menyalahkan ya	negative
woi bocor data ulang bertanggungjawab	negative
26 juta data langgan indihome bocor cakup	negative
data bank indonesia duga bocor akibat retas 17 desember 2021 unggah dark tracer cantum data bocor capai 838 file 4809 megabyte	negative
data daftar ahu kayak bocor kemanamana 3x tawar urus badan minggu	negative
gempa data bank bocor what si next	negative
arti lu staf2 lu mengaku kalo lu kompeten membiarkan data breach data2 pribadi masyarakat bocor dipakai pinjol teror sales judi online mending presiden reshuffle nih menteri deh	negative
kait isu data bocor aman lap mudah laku retas rumor edar luas tanggap bikin kisruh lapis masyarakat	negative
mak lot ganggu biaya mahal data bocor niat kerja sih woy	negative
15 juta data nasabah bsi bocor menteri bumn tanggung	negative
54 juta akun data pribadi twitter bocor indonesia	negative
data bocor kemanamana	negative
lawan data bocor kominfo	negative
heran berkali2 data bocor gin diam	negative
bocor data pribadi nahas kali timpa polisi duga ribu data anggota polisi bocor gratis internet	negative
data pasien covid19 bocor dampak	negative
no 1 pokok nya kerjain data masyarakat bocor urus sekian	negative
data motor bocor ngentooot	negative
netizen saran ganti kominfo data bocor	negative
nik ufk daftar eja beres rajuat salah awas kalo data bocor milu	negative
data bocor hoax nangkep tim cyber lulus tani negara penuh petinggi dungu pentingin urus pribadi mampus lu banteng tolol	negative
men judge sih jaga data warga indonesia bocor ngelacak lokasi ragu	negative
takut kondisi data bocor rentet 2 powerful data opini publik	negative
mending lo menteri terang deh data bocor anteng	negative
data kipk bocor kga lolos gue bgimama ya	negative
ya dibuatin uu sih pegang data kalo bocor kena tuntuan hukum biar mikir memegang data	negative
lokasi server script bukti serius perintah apps peting ya just my opinion orang bebas kankominfo data center ditaro data center kominfo kalo bocor gin tgg	negative
data luhut bocor tele bang	negative
data bocor deh kayak muncul pinjol teman tuh data orang-orang apply pinjol pakai data orang orang kartu perdana beli box2an teresgitrasi	negative
bilang canda hey kekisuran data bocor kredibilitas coreng bunuh ya canda benah citra ujung bohong	negative
tolong ya mudah data wajib pajak bocor pegawai	negative
data mypertamina bocor nama email nik npwp nomor telepon alamat tanggal lahir jenis kelamin gaji	negative
bukti data2 bocor data	negative
simpan data kian bocor peretasfix the security system then you can implement the rest	negative
duh gawat opensea data email bocor publik	negative
ya diapaapain db nya data nya bocor ambil hacker nya sih	negative
opini aman data kitamelihat peristiwa erat kait data pribadi bocor anonim perintah tanggap kontroversialselengkapnya sila kunjung httpstcotgpd92w0ha	negative
pln data langgan bocor replikasi httpstcodxcafjciey	negative
ya kalo bocor ya tanggung orang nyebar kena salah nyuruh nyetor data	negative
anjir anjir capek gue serah kopingmo deh data bocor hshshankq	negative
aman data gue jengah tangan seolah2 perintah biar data2 sensitif biar bocor jual belikan oknum pejabat2 wenang	negative
orang indonesia menyalahkan hacker data bocoryg menyerang perintah	negative
menonton kompastv data sim card bocorpk mentr1 wifi rumah ganti mudah bobollaaah acara stand up sore ya	positive
ya 1 data bocor biar pikir tenang	negative
tuju data pribadi duduk bocor perintah wakada soksok metaverse ektp fotokopi woy	negative
heran bocor data data	negative
larang warga negara bersangkutankita indonesia data bukalapak tokopedia kpu bpjs kes bocor privasi bebas pakai huawei xiaomi	negative
benaran bocor arti orang data bong bocor	negative
data bocor batal genteng bocor bahaya lho bocor data bincang opini kumparanplus vs perintah langsung join	negative
slogan perintah kerja kerja kerja tiup bjorka kerja mengapai deh laba data tri bocor ketahuankan booster rakyat tumbal coba vaksin gilir	positive
buka download resiko tanggung data cyber crime decryptor ransomenya data bocoryg rame httpstcok4iv0prdhb	negative
data bsi bocor ktpnya jual beli skrgmah bocor data	negative
data milik nomor selular bocor ya khawatir kalo rekening bobol khawatir chatchat wa bocor cemas kalo data dipakai pinjam orang	negative
duga bocor data langgan pln indihome telkom viral media sosial pekan dampak konsumen data bocor	negative
erick thohir marah data pribadi bocor beliau dokumen rahasia jaga daulat digital ri	negative
data pribadi bocor website gelap oh yaudah blokir websitenya indonesia problem solved	negative
ya elah bjorka muncul data bocor 2000an alibi nya request by netizen indonesia muncul bawa sambo nya bocor data mafia bbm kayak nya bagus	negative
pffftttt urus noh data bocor	negative
no salty kalo data bocor kayak gin resiko	negative
walach piye ki data bocor iso amuk ning ya pengaruhe opo nek data bocor embuh data ku ya kena bocor nek internetan ya aman wae oalah yowis aman ora sono maling opo piye ya ben wae disik	negative
maksud mas nya worthless data orang indonesia bocor cth bpjs kemarin dll data ya kemarin2 bocor	negative
data langgan bocor nih	negative
johnny plate ganti nomor amerika data pribadi bocor serang siberkoplakpresiden jokowi lebay begitubeginilah kalo pilih orang partai mengerti bidangnyaanggaran 26 triliun kominfo bangun sekuriti kuat aman	negative
nama ana foto nya laki nomor data gue bocor wa gue masuk spam fraud	negative
spam sms whatsapp nomor menawari slot judi credit etc gadiurusin data pribadi orang bobol security lemah nik jokowi bocor kayak dianggep remehgapedulian dunno	negative
pasal 21 ayat 1 ampas data peduli lindung bocor	negative
min data bocor pertangung	negative
alami modus ngakunya cs konfirmasi no telf rumah denpasar nunggak bayar bilang rumah bilang arti data pribadi bocor ktpsim hilang no telf rumah an bantu	negative
gua nyerahgua rate 1 gua maki2 reviewdan gua janji instal aplikasi setan lagisudah bocor data data rubah dllfuck you	negative
kalo sih hudiya bkl kejar sakya sih personal data perusaahan bocor naye doang but semoga baning cepat ketangkep nya deh biar tenang tuh naye	negative
anjir main slot data gue bocor deh memasuki data sembarang kena	negative
usaha iso 27001 data bocorbeberapa konteks usaha sertifikasi jamin data 100 aman	negative
serius data lu bocor	negative
film dokumenter the social dilemmaoiya cek data pribadi bocor httpstcootvlyli4thterima kasih	negative
aplikasi meta rentan banget data pribadi pse akses kesana mengasih lembaga instansi awas ketat data pribadi vaksin bocor data ektp bocor jual darknet dta pse wkwkwk	negative
wkwk iya saking parnonya data password sosmed account enggak ada kayak capek kalo bocor ganti password	negative
no kakak didpt hacker kampung data bocor aplikasi pl 2020silam	negative
data instansi mudah bocor	negative
gue idola gue jujur dukung ya respon perintah lho mengesalkan banget anjir kalo dukung data bocor gue dukung tulus hati	positive
bobrok banget deh data kelola gov gampang banget bocor	negative
registrasi nik kakak pas data nya bocor lepas tangan super	negative
buah utas data pribadi gampang bocor ya kayak genteng rumah	positive
iki maksude piye ngechek data pribadi bocor nyerahin data pribadi	negative
buka thread bjorka share forum bang lihat gih data bocor data kpu kau bilang data biodata kalo abal-abal dpr kominfo takut kocak bahas rapat	negative
bssn data bank indonesia bocor nyata desember 2021 httpstcolbtg0dy9wq	negative
iya heran ya dpat nomor2 nasabah bri arti data nya bocor kali nge share tipu	positive
data indihome bocor jir nasib history browser gua	negative
data guru bocor ombudsman banten nilai dindikbud banten kompeten	positive
no 13 no surprise hayoloh data pnsnya bocor ingetinget upload pas isi sapk	negative
klik link get 2500 pakai email daftar takut data pribadi bocor ngeri ya uang taruh data pribadi bocor	negative
menyimpan rekam jejak sehat pribadi data bocor mending aman data programaplikasi perintah	negative
lu pakai fb twitter orang indonesia data lu bocor lu komplain	negative
kominfo pintar urus data bocor mah bodo	negative
tolong ya tindak sih data nasabah bocor krim akun	positive
data bansos bocor parno data2 disalahgunakan perintah	negative
safenet 13 miliar data pribadi bocor tanggung	negative
data bocor	negative
data bocor kemarin resin kali	negative
coba cek httpstcoognw8gry1g data bocor ganote situs jalan koneksi internet	negative
ujung2nya rakyat suruh jaga sendiri2 data bocor tanggung iki piye paksa nyetor ganti tri kapabel	negative
bjorka data bocor perintah tutup mata bom ledak bingung	negative
simpan username password browser bahaya lho browser hack data bocor	negative
duga data nasabah bank jatim bocor ketua dpd ri desak polisi usut tuntas	negative
ya saran cakup data pribadi data deh lanjur bocor ya ya	negative
tau nih data kita2 bocor orang-orang kayak lo salahsatu	negative
ironis lihat iklan g20 edisi informatika 40 fafifu edar acaraacara berita pagi minggu data rakyat bocor terangterangan diperjualbelikan apaapa	negative
ya data bu puan bocor wkwk	negative
remaja 19 tangkap data langgar optus bocor sms scam	negative
data bocor	negative
lantas tugas jaga data bocor sekuriti komplek	negative
biarkan sangkut statemen kalo data pribadi bocor enggak apa-apa	negative
wkwkw tukad data pribadi ku bocor eh ya	negative
aduh kalo surabaya mimpin gue nertibin perusahaan2 aplikasi bang tuh internet industri cuannya ditertibin presiden kalo data bocor dll beda jgnkan wa dana bank bocor sistem bank secure	negative
13 miliar data daftar kartu sim telepon duga bocor	negative
gila silat lidah jago banget muter muter ban konfirmasi putar logika data nasabah aman database bsi ya iya sih data bocor pegang	positive
pas data pribadi lo bocor lu merasai lu mpe jarang ngaceng efek gara-gara peristiwa nyebabin lo tuntut 1 triliun tapj	negative
gawat 235 juta data pribadi twitter duga bocor	negative
before that tuktuk bilang kalo data ucup bocor gue kayak enggak bisa deh deh gofar bilang ucup pas gue kayak menangis	negative
kayak riskan kasih barang bekas data takut bocor hapus data direcovery kasih bekas	negative
lihat reaksi perintah kayak 2000 data bocor cuman kayak hacker muncul	negative
solusi data pribadi bocor rekening buka orang data bocor	negative
data pertamina bocor bpjs bocor tokopedia bocor alodoc bocor hedeh kayak gin ikn metaverse	negative
ribet aamat sih komen data bocor data bocer takut data bocor enggak usah pakai opsi enggak pakai mukakmu komen kayak sosmednya enggak pernah posting foto muka indonesia heran	negative
harga ya beli butuh mobilitas daftar mypertamina kumpulin data eh bocor	negative
13 miliar data sim card duga bocor simak 3 cek aman ponsel	negative
ayo kalo data presiden bocor arti tanggung ngotot tanggung	negative
gila lho nik nomor ponsel data pribadi wni bocor kemanamana serius aman aman nasional bijak psekalo enggak bisa mending bubar bikin komisi kalo mah	negative
seniman merespon bocor data pribadi bungkus goreng	negative
klausul rahasia data hello lu hidup dengar data bocor peduli lindung kartu sim dll	neutral
data indonesia murah ya wkwk renyah enggak ada harga gapapa ambil data kalo besok orang hilang nyata masuk korban human trafficking gegara data bocor kominfo tanggung	negative
iya ya dering banget indonesia data bocor kak chi isi data2 nomer hp ktp	negative
bjorka agresif data psikometris bocor	negative
data bocor data bocor ken tukang tambal data bocor	negative
min akun mandiri care palsu kemarin chat arti data bocor ya	neutral
tuh bocor nambalnya pakai sih deh coba aquaproof coba deh jamin no wahid	negative
thr rungatus yuta data bocor hwakakakakaka	negative
kalo barang cod mesen ya bayar modus tipu kadang data alamat bocor dijadikan kayak gin nih	negative
wajib daftar nomer sim card no telpon pakai nik kakak memcegah spam nyata mala data bocor jual kalo gin aman ancam	negative
oalah pantesan data bocor mindsetnya nyata	negative
splitting awal-awal biar informasi data test bocor istilah leakage standardization data trainnya distandardize mean stddevnya data test distandardize dasar mean stddev data train	negative
heran sih kali data pribadi bocor libat nik ktp retas cyber crime indonesia kayak nyantai nyantai kalo	negative
data bocor	negative
pasien covid19 duga bocor jual forum gelap muhaimin 3 langkah laku pikir rakyat tasikmalaya pikir rakyat	negative
laku datainformasi sengaja bocor tingkat hilir 1 ubah password tingkat aman 2 password manager 3 ganti email provider amanbeda kalo bocor tingkat hulu 1 pasrah 2 doa	negative
dark tracer 102 juta data ktp bocor menteri sosial ri httpstconhfrefga3o	negative
website judi approve steam dkk bayar pajak lohitu hibur game coba kepo banget detailtar kalo data cc bocor tanggung kah tri	negative
data bocor kayak kuatir ya jugaskrg mah ngeri pinjol anjay	negative
kasihan kemarin data telkomsel nya bocorbikin mewek mengadu bareynah lo ngamuk data rumah lo obralsadar ya nyetrezim bentar hidup lo tenangawas amfal	negative
alhamdulillah 1m bohong hiya hiya hiyatadi pagi kurir manggil pokat paket mesen barang ecommerce buka nyata isi surat beginianbagian seram data alamat dkk fix bocor halhal kayak gin	negative
pakai ngluncurin fitur aneh aneh sewa orang security data bocor tuh cc	negative
maaf ya moots kalo bom puas menghujat anjing bangsat babi moga kantor roboh uang makan rayap keselek nasi makan hack data kerja bocor saham turun 999999 sekian terima kasih	negative
samsung gercep negara salahsalahin warga bocor data	negative
banget dokk data bocor	negative
abai dishare manis nya ruu kesehatanyang halusinasi tanggung jawabkantanya data genom bocor tanggung	negative
kemarin bocor data bukalapak edmodo wattpad wordpress	negative
data juta pasien bocor kemenkes telusur	negative
inna lillahi bocor claimed data jaga rahasia	negative
data pribadi bocor ya tips hindar tipu bank mandiri	negative
alihalih laku remediasi langkahlangkah korektif cegah penyalahgunaan data sensitif bocor perintah nampaknya fokus kejar bobol data kejar maling kompleks belah	negative
bisa2nya menyalahkan user pas data bocor kalo bocor 1 2 orang sih ya kehack password gampang bocor data juta orang ambil database sistem perintah enak menyalahkan masyarakat lawak orang wkwkwk	negative
amann kak gue benar-benar jaga data kalo data bocor kena ojk	negative
bocor media serang gencar data istilah buka informasi publik	negative
meta bantah data whatsapp bocor jual online	negative
korban doxing bjorka deret jabat negara data bocor nama bjorka tuai perhati publik lantar klaim hasil bocor data pribadi httpstcopct856ztjr	negative
jelas-jelas pse akses data perintah platform terdafatarmisal data bocor tanggung sendirisendiri	negative
pesan hatihati sebar informasi sumber bareskrim cari laku kali sebar hoaks data milu 2024 bocor	negative
sorot data bocor dpr tangan kamsiber angetanget ta ayam	negative
data intel bocor data polisi bocor data apakabar	negative
data bocor bodoamat kynya data gua bocor jaman ektp	negative
bosan woy data rakyat mulu bocor hekernya sekal coba main data perintah kayak coba berkas budgeting leak biar seru	negative
mengaku karantina data rachel wisma atlet bocor	negative
gue korban data bocor bpjs gue nik dipakai orang bpjs gue gaaktif gue tegor mengurus haha hehe doang mirisss	negative
data bocor suruh jaga nik pakai fotokopi ktp konon e ktp anggar gede korup	negative
korban data bocor kominfo toke	negative
data bocor anggar bocor rumah bocor perut bocor	negative
perintah kalo data bocor ya hukum regulator regulasi	negative
data duduk indonesia bocor laku perintah rakyat benarrrr ancam uu ite	negative
bjorka duga kuat orang asli indonesia forum aman siber data 13 miliar bocor beli orang	negative
data bocor email pribadi karyawan hyv key api config kodingan databasenya wkwk bilang leak rem securitynya	negative
13 miliar data nomor ponsel indonesia bocor ecek klik baca httpstcodm52mbopwmokelahmungkin bocor logis sih 13 miliar data nomor ponsel duduk 272 juta arti 4 nomor duduk percaya	negative
oke kalo terima proses hiring gampang kalo diapakan tuh datahrsnya apply online cv sisa detail lamar terima pls hati-hati memasuki data online indonesia banget bocor data	negative
poin vpn data bocor situs govt nya	negative
editorial bocor data lindung negara	negative
situ nya badan ojk awas pinjam sedia usaha digital non digital 1memastikan data user aman bocor 2memastikan suku bunga batas wajar 3memastikan service collect sop 4dll	negative
rf research henti ya kr2 rf bf relasi raiding bf case data shanghai bocor diraid chinese tarik kenal orang indonesia menawari bongkar	negative
bareskrim buru sebar hoaks data milu 2024 bocor	negative
data pribadi bocor	negative
reply orang bom paham ngambil cicil kpr bi checking noda susahdiperparah data bocor gampang noda deh data bi checking moga sadar privacy data ya	negative
kominfo selidik viralnya 13 miliar data sim card duga bocor jual pasar gelap	negative
indonesia drama data bocor sistem security nya hebat bocor	negative
untung latah buka ig story orang jarang cenderung tau rame penyalahgunaan data ki marak tipu dsj sadar bocor data masyarakat institusi negara upaya	negative
ribet rio beli sabun was2 data bocor	negative
gue nolak data gue pakai testing situ ngamok2bawa2 indak tae bocor tanggung indak jelas-jelas agreement gue client client jamin aman data gue	negative
bahaya data bocor langgar privasi risiko manipulasi data rem sih	negative
kalo startup gede mah jamin sih data costumer nya kalo bocor salah konsumen menuntut uu nya	negative
kalo data belio bocor belio ngadunya kali ya	negative
data bocor	negative
waahh langsung cek data milu nih jangan-jangan daftar nik orang-orang bocor parpol	negative
anjir bocor data	negative
masuk data bocor ya	negative
kominfo amanin data warga negara indonesia bocor astaga	negative
beda kominfo pakar data kartu sim bocor 100 valid httpstcomvsc3clxc1	negative
gapapa kalo data bocor menyesal ya	negative
bukti system aman website perintah indonesia lemah retas juta kali hacker indonesia heran data data rakyat bocor	negative
semangat pagi beli lupa goreng cangkir kopi beli optimis candle turun kalo pidato nya powel dovish terbang ya beli kalo data bocor sor kecuali pidato nya hawkish ya beli	negative
bahaya data bocor potensi sarana jahat	negative
data sekolah bocor	negative
kontol gara-gara data bocor teman-teman gue masuk gue chat orang kagak ditawarin kerja investasi	negative
data customer mandiri bocor gin	negative
ya data rahasia bocor	negative
laahhhh lu spill data sianies bocor sih lu pea membuktikan gue pantengin kompas coba kasih gue lumayan gue wa selamat istirahat anies gece	negative
mbesok memilih menteri masak menjaga nik data nik bocor	negative
tag biar urus bocor data negeri mulu dalem beres	negative
data pasien indonesia kabar bocor forum dark raid data bocor 720 gb 6 juta pasien	negative
negeri betulbetul gagal sempurna privasi data duduk bocor 13miliar mudah eh pas banget warga peduli data bocor peduli ghibahin hidup pribadi orang	negative
bocor is bocor ya data ngerembes	negative
data 6 juta pasien covid19 milik kemenkes duga bocor jual forum gelap raid forums kamis 61	negative
enak growth hack ala perintah ngeribetin orang data bocor	negative
aman data pedulilindungi masuk sertifikat vaksin publikasi data bocor laku orang tanggung sebar hoax	negative
data kartu debit kredit tri dprri bocor lumayan kalo bocor mencoba langgan netflix spotify	negative
ditangkep nangkep bjorka bocor jual forum darkweb aman data doang benah	negative
kak nit nih kampus data orang tuanya nama deh maaf kalo pakai nama valeri jo staff khusus bayar bocor data	negative
blokarblokir tau tau data bocor	negative
data registrasi 13 miliar ponsel indonesia duga bocor reaksi kominfo httpstcomsyatkvpp4 via	negative
polri buru laku sebar hoaks data kpu milu 2024 bocor	negative
hahaha lucu deh data rakyat bocor banding data obral obral ya	negative
telkom periksa data 26 juta langgan indihome duga bocor	negative
alamat paket data manusia indonesia bocor	neutral
pecah rekor negara jenis data bocor kah negara wkwkanda ah elah	negative
kali gue kontra lu kalo data bocor tuntut via adil perintah mengatur langgar hak gue akses	negative
halo bri tindak hadap nomor2 scam tarif transfer bri berulang2 wa sms data nasabah bocor sembarang	negative
data presiden anggap bocor data kpu 2019 hubung aplikasi pedulilindungi	negative
sih nih data norek bocor rem	negative
rampung 13 miliar data daftar kartu sim bocor muncul duga bocor data pns data sifat pribadi	negative
data face recognition dukcapil bocor cc	negative
gin wajib daftar kartu sim card pakai nik masak tanggung nya atur nya aturansanggup jaga data bocor masyarakat suruh jaga merekayg nyuruh data nyakena	negative
ganti nomor kak jalan 1 1nya data kakak bocor dipakai orang kayak	negative
mohon maaf ketidaknyamanan kawankawan kontak data bocor disalahgunakan orang bertanggungjawab pinjam bilang pinjam pinjam online ilegal	negative
berita bilang data warga indonesia bocor sengaja bikin jabat biar pakai nama orang random seenaknyav	negative
tokped data bocor denda 400 kominfo bocor 4 kali denda	negative
salah contoh duga bocor data ehac electronic health alert card milik masyarakat indonesia situs vpnmentor nyata 13 juta data pribadi cakup nama lengkap kerja data bocor	negative
aman data baca bocor	negative
jamin data bocor anggar gin hidup wni	negative
ancam data pribadi bocor erick thohir ajak ahli digital retas lokal lindung ri httpstcoximmcpvahm	negative
lamalama data bocor kayak canda deh dit wkwkwkw banget	negative
kayak orang ye data bocor	negative
data tokped bocor ya nya kemarin belanja tokped langsung nomer nelp mngatasanamakan tokped barang beli hmm	negative
privacy data artis bocor lu bela mulu hybe hybe mikir duit kakao kakao bungkam hybe memikirkan manusia artis nya exploit exploit	negative
nih pikir gue deh usil bocor sengaja bocorin gin lho nama assessment security data ya masak major kayak gin tangkap pikir gue jelek	negative
bisa2nya data lord tuan agung bocor wwkwk	negative
data bocor mah	negative
enggak ada data bocor kak	negative
data bocor nasabah daya sistem login website bukti aman reliablejangan logika mengaco masak iya sistem aman lindung nasabah nasabah daya	negative
tuju kak data share aplikasi data disalahgunakan bukti deh kali curi data tmsk kena imbas data bocor sindikat	negative
kagak tau sih tuntut riil nya benaran 300 miliar won kagatpi kalo benaran lembaga mah at least lindung hukum kali sih data bocor kayak bgtep 1516 asa wisata ulang wkwk	negative
ngalamin sulit apply jenius data ktp bocor maksud	negative
kominfo panggil manajemen pln data bocor	negative
enggak usah takut data bocor saudara saudara kawal ramai alih isu	negative
data bocor tokped bsi obral data qoeh	negative
data pegawai kabupaten sukoharjo bocor deep web	negative
lawak bikin bijak urus data bocor noh bikin susah masyarakat	negative
34 data 70 metaverse indonesia bocor jual hacker	negative
asa gue doang data bocor ya data deh	negative
ayo kegoblogan mu biar retas n data negara bocor bis bubar nih negara gara-gara gabecus memilih sdm	negative
semmy lindung data pribadi laku pse daftar bang nama privacy policy laku bertahuntahun pakai data jamin aman nyata data bocor bpjs	negative
mari data bocor lak akeh smstlpwa aneh-aneh iku arek2 dok ng tl wa nyasar aneh-aneh	negative
sing pink data bocor	negative
anjir bombastis banget bilang data surat kpresiden bocor olah data banget duplikasi lihat surat keluart masuk doang	negative
dipotokopi bocor bijimana kalo data lo server enggak jelas akses lol	negative
waspada data bocor salah orang	negative
data rahasia kalo jabat negara istri 2 selingkuh teh kalo bocor panik kayak tuh heheh	negative
bocor mulu nih data pakai sayap	negative
pakai salahkan perintah data pribadi bocor lu kasih link duithadiah grub wa lu klik goblok	negative
sisi sisi ente kadangkadang paham luas ajar komprehensif kah hadeh kurangg mengerti memaksakan membela orang data bocor datageneral	negative
13 miliar data registrasi kartu sim isi nik nomor telepon operator seluler tanggal duga bocor diperjualbelikan situs gelap	negative
bocor data sim nya ya tau	negative
telemarketernya bilang telpon arti data bocor ya tau nama	negative
