apatis negara capek ngikuti sambo data bocor potong tahan koruptor koruptor bebas syarat numpuk berdekatanbelum tuchel pecat ajgggg	negative
data kemenkes bocor raid forum	negative
kcuali ngebocorin data mafia jabat doang nyasar kakak warga tau tau coba deh cek tau data papa mama mu bocor dek	negative
menkominfo data kartu sim bocor bssn httpstco7q05keawm7	negative
kena phising ganti lps bangdgn data vital bocor mudah hacker nguras rekening	negative
tau gampang banget ya data bocor planet namec	negative
menkominfo warga jaga nik isu data bocor respons najwa shihab tohok	negative
data intelejen bocor heran data publik update	negative
bocor data ku	negative
13 daftar bocor data ri surat rahasia jokowi bocor	negative
data nasabah bank jatim bocor dpd ri desak polisi usut tuntas	negative
kominfo panggil pln duga data bocor	negative
cowok tukang bubur ya cewek tau sih cowok iya data keluarga bocor kemarin hehe	negative
uang subsidi alih kominfo biar data bocor lmao	negative
mah parah boro kuasa data data warga bocor mulujargon mah keren metaverse	negative
data bocor kominfo pt pln	negative
nama pakai aneh aneh ya selamat deh bentar politik nama tibatiba dipakai urus partai senang data bocor	positive
nama ana nama profil arumi ngehack data bocor nih	negative
negeri ku lucu tru kalo data rakyat bocor kemarin lapor	negative
mengurus spam sms data bocor enggak usah lang jauh2 kecengklak entar	negative
deh kadung bocor data registrasi 4444 deh gondol tinggal tunggu momentum tagih pinjol	negative
takut data bocor bocor ya kak	negative
bukti kalo data bocor	negative
laiya ya rakyat capek capek byar pajak ngegaji harap aman data data bocor becus kerja	negative
susah beli 1 suruh fotokopi data bocor manamana fotokopi dijadikan bungkus goreng minimarket	negative
btw bocorin data orang ya kak kalo data bocor nampung orang dasar laku orang	negative
bjorkanya data bocor perintah nanggapi kait bjorkanya ngelu2kan bjorka korban data bocor	negative
picek matamumending maaf buka nasabahnasabah tanggung fafifu pakai buzzerkalo mengomongkan teknis sistem basis data data bocor ditampilim data fieldnya ya jaka sembung bawa golok rai	negative
stay private jaga privasi sosial media data pribadi bocor hacker	negative
serbaserbi mmc data pribadi retas sebar isu 26 juta riwayat cari nama nomor induk duduk nik langgan indihome bocor gratis situs gelap solusi simak httpstcopwtcc1quw5	negative
data bocor eh didiemin	negative
berita data jebol web resmi tau data bocor salah bkalapak tkped anjur ganti psw	negative
jual database internet kalo dengar data bpjs bocor data ecommerce bocor ya beli utama	negative
cek nomor sim card prabayar bocorhttpstcoxkmarhqhom	negative
kacau men bocor data	negative
data mudah bocor haha	negative
perintah ngelanggar atur ya tri jaga rahasia data data jebol salah timbang aplikasi daftar takut bocor data customer	negative
subsidi bocor cabut data bocor wajib isi data cabut	negative
ngalihin isu mulu data bocor deh dibenerin	negative
data nasabab bsi bocor	negative
pakai awas data bocor	negative
bodoh data data bank bocor urus anjing	negative
bocor data baja film sumber data bocor sedia hilang data disebarluaskan sulit musnah data bocor	negative
laku data bocor	negative
paksa daftar pse data bocor jenis lengkap ayo kominfo peduli keman data benerin	negative
kominfo bikin case drama wyw data raon bocor wkwkwk	negative
bodo ganggu data bocor menyalahkan perintah bilang ya data gue bocor	negative
data langgan indihome bocor pt telkom ragu asli	negative
berita kalo bunuh selingkuh data bocor huft	negative
data bocor sebar publik mari sikap evaluasi jaga daulat digital ri	positive
mengurusi slebew mending mengurusi data pendudukrakyat bocor kalo data pegawai kominfo bocor gue beli wkwkwk	negative
eug duga muncul bjorka direspon tingkat daulat internet negeri ujung atur restriktif isppsepadahal bocor data perintah pakai awsazure servernya negeri	negative
telkom group klaim data duga bocor valid alias hoaks	negative
bah data privasi data privasi mah bocor bang ktp bocor	negative
tau data rawan bocor main data2 an	negative
paradox internet benci data online bocor retas postingan skrinsut chat reveal nama username konten-konten confess rame-rame dasar keberatan2 nih data kasig	negative
entar data bocor wkwk	negative
data bank indonesia duga bocor informasi sumber akun twitter dark tracer	negative
gawat jangan-jangan data 11000 t bocor	negative
parno data bocor	negative
data peduli lindung bocor mah	neutral
data bocor aksi gaes	negative
data langgan indihome bocor tri kominfo rekomendasi tingkat lindung data pribadi telkom	negative
linknya kalo suruh memasuki ktp orang data pribadi lupa kasih watermark ya biar kalo bocor tau	negative
data pertamina bocor tau hok	negative
scammer main hubung calon korban 1waktusituasi bikin fokusdini haribikin panik kata2polisimusibah 2mnunjukkan infodata percaya nih perhati kalo data bocor pegang scammer hati-hati	negative
data presiden bocor bjorka data remahremah	negative
bilang kalo nomor jobstreet kemarin dichat arti data bocor jual belikan	negative
data kemenkos bocor ktp kalo tanggung bilang	negative
mr21 info kemarin pink venom rilis duga data pln bocor httpstcojt2s9eq2xc	negative
aman data duduk sih bocorsemakin kuat tekad ku pergi dunia anime	negative
asang aseng asang aseng idih kayak marketing indonesia tukang sebar data gue memakai app kayak amino gue bocor data gue memakai ojol deh data bocor kemanamana	negative
data ktp kakak bocor pakai registrasi no sim card nyata fukk beli no hape ndk registrasi hebat data proteksi indonesia	negative
data warga ri bocor platform digital denda pidana	negative
kominfo tindaklanjuti duga data pasien rs bocor	negative
2023 ancam resesi global jalan negara efektif sumberdaya alam bocor rampok mafia nya data esdm 2021 2700 tambang ilegal indonesia	negative
asa gue doang data bocor ya data deh	negative
menteri bilang indonesia peluang kembang metaverse dunia data open source noh lamar pertamina kena bocor komplit bocor ktp kakak ijazah dkkketerima kagak data pribadi sebar iya	negative
kalo bobol akun pakai otp nomer hp ya data nama no hp alamat bocor	negative
data history wifi lo bocor	negative
data orang indonesia doang gin gue orang steam mah kasih naro tc orang indonesia data bocor nanggung	negative
wakil ketua fpks data kominfo bocor hilang percaya kominfo	negative
data ehac bocor kemarin	negative
coba periksa httpstcorp7ljym2vr biar tau data bocor	negative
pagi telpon untung autoblock unknown numbernya aktif telpon semenjak berita data sim card bocor	negative
tusir data pasien covid19 duga bocor	negative
lawak banget nih negara data bin bocor	negative
puluh juta data registrasi kendara bocor jaja internet httpstco1um6ywezlh	negative
iyanih gacuma data negara bocor data pribadi gue bocor	negative
mengurusi data bocor berkali2 becus anggar ditanyain teknis paham menambah anggar masuk perut hasil	positive
bayang data pribadi bocor sebar lindung identitas mudah identifikasi orang bahaya data privasi bocor	negative
bocor dimane mane sih benaran kah 105 juta data kpu duga bocor jual online data validklik link baca	negative
kepala sekretariat presiden kasetpres heru budi hartono data bocor kait surat label rahasia badan intelijen negara bin data pribadi milik jabat publik masuk presiden joko widodo hoaks	negative
data lamar web pertamina bocor	negative
26 juta riwayat browsing indihome duga bocor weehh kenpa ya nya data retas simak yuk serba serbi mmc	neutral
indonesia perkara bikin overthinking harga barang pokok data pribadi bocor bunuh beresberes koruptor dibebasin enak buzzerp manamana capek ngetiknya euy	negative
menkominfo warga jaga nik isu data bocor respons najwa shihab tohok	negative
habis cek email nyata bocor wattpad cek email periksa data bocor	negative
ya tuntut nih menteri masyarakat data pribadi bocor juta	negative
wkwkwk asai maksudnya piye bukti kadrun nih kalo mengoceh pakai data santuy sampeyan anak kondom bocor	negative
indonesia data deh bocor kemana2	negative
rahasian rahasian data bocor lambat jual bebas indihome bangsat	negative
ramai banget media nyebutkan data langgan indihome bocor nyata berita baca koran daulat rakyat edisi rabu 24 agustus 2022 10 judul telkom aman data langgan baca gambar ya	positive
sih bjorka snowden gue curiga sih tipe manusia data bin bocor bocor tau gue akses batas beda data tuduh instansi simpan	negative
hobi ngacak frekuensi sinyal kencang blokir bokep steam dkk blokir ragara atur pse gilir data privasi bocor jahat cyber kayak ngurusnya mimpi ndakik bukit algoritma tri isi orang politik tri kompeten	negative
data takut bocor woi telor data peduli lindung bocor data presiden konyol	negative
pakai cuman gegara baca data customers bocor tokped ragu download app nya	negative
re update pusat menyimpan data hilang bocor kemana2	negative
min coba kasih alas data pribadi masyarakat indonesia bocor	negative
data bocor bosbisa kerja	negative
ya asumsi data benar-benar bocor kendali orang butuh tuju digital sign verifikasi nomer hp email pemberitahuannya	negative
dear loh akun laku sebar hoax data milu 2024 bocorakun gonggong nih kayak terima 6 ekor anjing mati tabrak jalan tol ya susul 6 anjing mati	negative
kpu nilai data bocor kes mengadaada	positive
teliti aman siber teguh aprianto tim periksa data gugat bocor 279 juta data bpjs sehat adil 279 juta data duduk indonesia duga bocor jual forum retas raid forums 12 mei 2021	negative
bocor data	negative
data nya bocor negara salah	negative
woi akun fake menyerang customer lo nih sih data bocor nih ya	negative
indonesia data bpjs bocor jual deep web harga 100jt an	negative
44 juta data mypertamina duga bocor pakar siber bilang	negative
ojk sonde solusi suruh hati-hati b data bocor b data ju salah ee	negative
scam ngeriii nomor hp bocor manamana jerman isu data privacy nya	negative
kuat belumuntuk kali admin informasi kait periksa surat elektronik masuk data bocor sih periksa yuk simak infografisnya lupa diswipe	negative
pakai wa gb isu blokir data bocor langsung hapus pakai	negative
bingung banget nik muncul vaksin nama orang vaksin beda data bocor tlpn 119 pernh dm ig pernh siblas email diblas sumpah bingung banget mengadu semoga respon	negative
woy kominfo gue mending luvurusin data bocor mengomong slebew anjg	negative
warga plus enam kenal santuyjangan data perintah data warga bocor santuy perintah santuy tuh kayak	negative
ya salah perintah data bocor arti sih hacker pahlawan	negative
peduli lindung tanggung orang data nya bocor ngeblok jual sc nya wkwk ujung ujung ngeblok goblok	negative
rame data sim card bocor sore pesan whats app masuk kode telephone nigeria 234 kalo benaran bocor bahaya nih ngeri banget kait bocor data	negative
gustiii indihomeee untung deh pakai indihome bocor data data lu	negative
biar ktp gratis coblos ganjar den bokep maaf data negara bocor	negative
rapuh aman database kpai database curi jual forum hackerdata duga bocor cakup data identitas korban umurbayangkan predator daring data	negative
bahas metavers layan publik mending pastiin data kagak bocor naikin aman servernya metavers2 mah ngke heula	negative
hmm tau bsi hack nyata nasabah sih but data pas nasabah salah bank pas misah kayaknya bocorsoalnya email bsi tutup akun rek bsi	negative
sadurunge iki data indonesia wes bocor mergo apk pedulipeli	negative
pse data bocor	negative
rame bocor data data pemerintahapa kabar data base bank dishare manabuta	negative
oke bahas bocor dokumen identitas lumayan bahas fokus nft solusi alternatif tanggulang bocor dokumen sisi milik sisi platform data bocor	negative
situs ecek data pribadi bocor internet	negative
sih gampang banget nyebar data orang ktp rem banget jaman data bocor hati kalo posting sosmed	negative
kacau data langgan bocor	negative
langgan setia 11 data bocor beku nomer nama ganggu banget sumpah notif aplikasi web	negative
hindar bocor data pribadi unjung 5 situs cari data pribadi aman bocor	negative
sibuk ngeroasting mikir data bocor	negative
demen buka situs bk3p ketarketir nih data link nik ya data indihome bocor hoax banget mah	negative
buka rekening data bocor kirim adik tipu	negative
pindah lord luhut besok langsung geger data bocor ya tumannn	negative
data bpjs bocor data milu digital ambyar euy	negative
oh noooindo mengurus data pribadi wn bocor mengurus reaktor nuklir	negative
kumpul web forum online favorit jual data bocor hasil retas laku retas	negative
email nik data simpan rapi perintah bocor heran security data mbuhmbuhan	negative
kadang pikir mengasih musibah kayak gin biar dpr anak polisi peka kalo urus data bocor bahaya banget wkwkwkwkkwkw ya jahat banget kesan	negative
urus data bocor ente hujat2 menteri kader nasdem arti kualitas tau	negative
mengakak malu nang takut data bocor	negative
fuck kominfo again i live this nation of pain gon nya kill johnny plate with an akfourty sev data bocor nyuruh ganti password data bobol server kominfo boomer kolot tahi babi mending tanah	negative
data 6 juta pasien milik kemenkes duga bocor jual forum hacker	negative
lanjur data orang indomah gampang bocor kali	negative
perintah tolol over anying borong data bocor jaksa suap koruptor bebas demo surprise ultah kayak brow aing capek musti hina mane	negative
kayak nih data indodax bocor darktracer mengomongnya gin berhatihati terima informasi	negative
kominfo jamin data nik bocor ketuka wajib selular dat nik masyarakat suruh jaga aman nik jabat becus kerja mending mundur	negative
kualitas kali data2 user bocor sptnya ajar diambilini salah dampak negative duduk orang kompeten menkominfo bilang internet cepat data bocor	negative
kayak data gue bocor deh 3x berturutturut wasaf orang promote jalanjalan gratis duit	negative
lho bilang data bocor sih kayak kaget deh kerja mereka-mereka nih apa-apa bocor anggar bocor kelas data gapenting2 banget gabocor	negative
ah gakau indihome data bocor	negative
hormat bicara paypal steam usaha negeri lindung data user kominfo data pse ya orang kadang privasi wa bocor	negative
percaya data bin bocor ya awikwok pure paper based kalo dicopy hilang kakek aing mesin fc annya rusak server dipakai pcare kemenkes backup pl kalo info anggota mentok ya superficial doang	negative
ngandelin ktp deh orang data bocor dimanamana 14jt duh gue deh pap bareng ibuknya jamin	negative
dih bacot banget deh data lu bocor ganti password menit	negative
bocor nama lengkap email no telepon hash password salt provinsi kota kode pos alamat rumah dll maksud data milik langgan bocor	negative
mudah nk faham data bocor	negative
data pln bocor salah	negative
lucu menteri nyuruh masyarakat jaga nik nya cegah bocor data data doi bocor	negative
maybank dakwa bocor data langgan palsu komited lindung data peribadi pelangganterdahulu buah hantar fb dedah 18 juta data langgan maybank bocor kandung nama penuh tarikh lahir alamat nombor kp	negative
satpam komplek data hun bocor aowkaowko makan tuh pse komintol	negative
data bocor rahasia banget sistem elektronik dampak santai	negative
sinyal bapuk ganggu mulu data nya bocor cabut dipersulitkontol banget	negative
data pribadi bocor panik laku caracara	negative
anjay data tri bocor semoga perintah buka mata hati	negative
data milu 2024 bocor polisi duga kpu sanggah buah video	negative
hahaha lucu deh data rakyat bocor banding data obral obral ya	negative
nya ai nomor tipu nama bank bni telpon bungulnya ai kominfo nih kd jaga data pribadi orang bocor lwn hacker	negative
gue jaring smartfren trouble nyata paket data habiss wkwkw minn paket data murah kantong nih saran hehe	positive
data sim card bocor cek	negative
banget dokk data bocor	negative
takut ya data bocor but mengirim terima kasih ya	positive
musim data bocor gin gue kagak tau mesti antisipasi pasrah banget	negative
enggak tau deh gua lihat aneh dukung bjorka jualin data bocor no hape	negative
astagah parker ee katong data bocor internet hahahaha	negative
hah event pakai kakak yaudah sih data orang indonesia bocor wkwk	negative
nih datakepentingan dirinnya takut sorot datadata bocor telusur netizen kwwkwkwk ya orang heker ledeki sebegitunya tampil sih nikita	negative
indak pusing data bocor data bocor tukang potokopi bungkus goreng	negative
tau sih coba takut aman takut data bocor dll	negative
buka link sembarang data bocor	negative
orang indonesia takut data bocor also orang indonesia upload sertif vaksin sosmed	negative
tobat porno porno mulu digatekeep data bocor sebar santai	negative
slebew banding data bocoritulah kominfo	negative
ih sih pinjam ya data ku bocor	negative
data nama ttl agama aman direlain bocorkalau data no telp alamat bocor pakai nerror jahat serius	negative
semoga enggak ada bocor data ya	negative
didu main kata-kata bpk ex jabat paham otoritas kominfo rakyat patuh instruksi nya kait kumpul data pribadi rakyat kumpul data bocor mesti pakai didu suruh mundur orang	negative
digitalisasi digitilisasi data bocor blokir situs upaya cegah tanggung	negative
reply kaget ngdrama dll mikir data dipakai orang jahat mikir data pribadi bocor tolerir barengbareng menuntut kait tanggungjawab hadeh	negative
data bpjs bocor wkwkwkwkkw	negative
data bocor kak	negative
pikir data bocor sih hacker mencoba akun orang passwordnya ya	negative
sok privasi deh data tuh bocor	negative
bikin pse ngamanin data bocor sabotase ya aneh kalo steam keamananya bagus ogah daftar lu	negative
prosedur putus jaring pinjol data aman tutup mata data bocor tempo	negative
alesannya data confidential menutupi cegah bocor manfaatin data	negative
data bocor hukum bbm harga bahan makan dj sih	negative
13 miliar kartu sim bocor vaksincom data pribadi otentik aktif httpstcop0xxq9jjcb	negative
data pribadi indihome bocor maksud pakai wifi indihome kah bocor wifi orang pakai	negative
data mahasiswa alum ub angkat 2020 sebar retas duga sebar data alumni mahasiswa s1 universitas brawijaya ub 2020	negative
musim ke4 stranger things rilis juli malware incar gemar serial muncul dunia maya hatihati data bocor	negative
data bocor informasi bocor milu bocor moga tutup kebocoran2	negative
rame data bocor ya kalo bocor data nik no kakak tinggal tunggu hidup hancur	negative
mndingan amanin data bocor utama	negative
1 ehac kemenkes vpnmentor salah situs ulas vpn publikasi temu bocor data database ehac kali 15 juli 2021 13 juta data duga bocor	negative
cari nyata creepy habis tau nama tanggal lahir nomor wa hadeh data bocor wkwkwkw bye dude youre blocked	negative
105 juta data pilih duga bocor pakar siber kpuparpol audit	negative
data bocor	negative
data server kemenkes duga bocor identitas pasien hasil radiologi	negative
11000 data mohon bocor uitm mohon maaf httpstcoqxikgvgbuf	negative
data presiden bocor data manusia	negative
digital qlue paham ngandalin jaki data bocor	negative
data takut data bocor takut broo pakai cloud storage indihome data aman hati tenang	negative
belaga milu pakai internet data lo noh bocor aplikasi kredit	negative
data bocor lu cerita pribadi sih pribadi lu data duduk	negative
situs tau nomor bocor nggaknya adminnya beli data database random search internet	negative
tiati data bocor bahaya bro	negative
sinopsis ikat cinta 27 november 2021 data jessica bocor tangan al rahasia irvan	negative
data bocor tuntut pakai uu ite ya	negative
data bocor sistem ganggu kayak maling listrik mati capek ya maklum	negative
bocor data kau tertawa kau mikir atuh	negative
berita data bocor seruak pekan duga data bocor genlife	negative
data bocor kominfo madam kebakaransaat evaluasi kait informasi potensi bocor data pln	negative
bocor data indonesia kalo berita uang bocor tanggul bocor pidio bokep bocor data bocor perintah peduli mengerti	negative
kayak gin marak banget ya kali gue baca twit jual beli data bocor gin	negative
netizen tipu data bocor data ecek2 gampang banget sih alih perhati netizen hahahahahaha142x	negative
doa mas bahaya sih serang hasil jangkau data sensitif data nasabah bocor buruk dana nasabah bongkar habis	negative
data warga negara bocor kominfo cuci tangan organisasi kayak bin gandeng vaksinasi sosialisasi rkuhp	negative
gin bang steam paypal dll ngikut pse jamin data bocor kominfo jaring kominfo tuh beda susah ngontrolnya kominfo selesai app	negative
sungguh bjorka data bocor tukang goreng	negative
kerja menkominfo data bocor ya turu	negative
mengaco uji layak ya sistem informasi perintah mencar mencar parah kalo bocor nik data	negative
50 ribu data indodax kabar bocor simak lengkap httpstco12hdhse3bn	negative
pikir regulasi kait data pribadi dar telp etc sederhana bocor	negative
rto data bocor ya kak silah direstart modem nya	neutral
telkomsel pln data bocor rupa data palsu sengaja sebar asli	negative
bank menawari mall itugue pikir data gue bocor salahgunakan sambung polisi manado logat kayak netral banget kayak orang manado gue tau logat asli teman orang manado asli gue	negative
nyimpan duit cash makan rayap nyimpan duit bank data bocor rekening bobol aman deh nyimpan duit bentuk aset kayak emas surat harga	negative
data identitas ribu anak rahasia bocor manamana data himpun komisi lindung anak indonesia 2016 bobol jual situs raidforums harga rp 70 ribu httpstcoetfmc2jtet	negative
isu kemarin kelar perintah mengasih syarat registrasi terima bsu memasuki data krusial kalo database bocor tanggung woe main lempar2an cih	negative
jaga aman internetan httpstcocyy8rgvuba jakarta berita data bocor seruak pekan duga data bocorada faktor men	negative
naah data bocor	negative
menonton full video mbak okky bareng yunusto be honest sinkron janji humanis realita lapang sikap case inikok aware hashtag telusur data rahasia bocor via anonim	neutral
data bocor biasakode alam	negative
13 miliar data sim card duga bocor simak 3 cek aman ponsel httpstcofyynl76z89	negative
data bocor bahaya banget contoh data nomor telp bocor nomor kena spamming iya kalo cuman spamming ngawur kalo spammingnya ujung scamming target orang gaptek kena tuh	negative
3 1 bocor sisi kominfo 2 sisi dukcapil milik data duduk 3 sisi operator milik data seluler	negative
data bocor	negative
jangan-jangan data gua bocor gegara	negative
eruh iki ta mbak han ngakunya jerman sak durunge subuh wis kirim wa ya eruh nomerku ra iki ya kalo data bocor cor	neutral
105 juta data duduk warga indonesia duga bocor jual forum online breached forums anggota forum username bjorka buah unggah situs breached forums judul indonesia citizenship database from kpu 105m	negative
pandang kapitalisme sekuler konten-konten unfaedah cuan oversharing sosmed disukaiya sob pandang islam kaffahmmc millenials mmc lovers httpstcofm412qaqpb	positive
data bocor pse lindung data bocor	negative
13 miliar data registrasi sim bocor cek no hpmu link	negative
tunggu data bpjs bocor	negative
what the jinjjaeyo beli nasi padang tambal ban kalo tambal data bocor	negative
pikir sih sim card beli konter hp aktif aktif pakai nik pakai data nik bocor ya	negative
perkara email ku bocor ketar tir main asli deh data privasi enggak bisa bayangkan as an artist asa hope he is protected	negative
rapat kerja yagimana ndk bocor kominpo orang ekonomi lindung datapaling korupsi menebalhahah	negative
website down data bocor mengomongkan metaverse wkwkwk	negative
kali 105 juta data duduk warga indonesia duga bocor jual forum online breached forums	negative
kominfo ngumpulin data gilir bocor menyalahkan	negative
gue gedek bank syariah ya bni syariah pakenya app bni eh ganti app ruwetskrg data bocor	negative
anjir data gue bocor dark web pin sih gue ganti alamat pindah sih nik nama emak gue sebar ah bsi sih jaga data nasabah untung gue pindahin baca	negative
orang nipu rem banget ya aman kalo main internet kayak isi gform takut data bocor menyimpan foto whatsapp bocor ngeri banget sih	negative
halah badut data bocor koar2 doang	negative
bocor nama data open source	negative
semenjak blokir kemarin kejadiankejadian data pribadi bocor dah	negative
nama gue daftar anggota partai politik efek data komintol bocor	negative
aman data langgan pln aman data bocor data replikasi data transaksional aktual update	negative
jaga deh bocor eh program integrasi data bocor	negative
anggota komisi i dpr ri fadli zon sorot lemah tingkat aman data siber instansi negara retas bocor masyarakat untun	negative
himbauan bilang data kominfo bocor tinggal bilang hoaks selesai masalahyou re welcome	negative
data uang jabat bocor ya	negative
harga negofaster response dm gua discord hamstersizedasian nomor gua deh data deh bocorawalnya menonton dwp hitc lineupnya relatable playlist gua	negative
bocor kali batrenya udaah ngembung coba matiin data tidur	negative
mengapai sih pakai acara daftar2 gajelassss kalo alas biar data bocor aneh banget	negative
data masyarakat bocor sok an cari data lawak negeri wakanda	negative
scan muka data bocor hack	negative
halo min min data marchant gobiz bocor orang nama gojek	negative
edward snowden bocor 10 data kawal httpstcoafbsu8zxpb washington 2013 kontraktor isi as edward snowden kejut dunia dedah bah	negative
bayang sih kalo aplikasi pl alat bayar digital aman nih kemarin data pribadi bocor	negative
didik indonesia butuh tata data aman data sendiriga heran data bocor	negative
feeling gue data pribadi pedulilindungi bocor jyakh	negative
tiada bocor data kayak tinggal menunggu gilir list identitas anak alter twitter bocor	negative
tagih dasar meter asumsi listrik bocor gara-gara tugas catat plnnya kadang menembak data meter visit rumah2 pas baneran visit dibenerin tuh catat	negative
komentar tolol bocor pusat data ganti password hp mbok ya anak buah ngablak	negative
kominfo panggil operator seluler telkomsel indosat xl axiata 1 3 miliar data sim card ponsel duga bocor hasil	negative
erick thohir mah santai ya data pribadi bocor data jaga daulat digital ri	negative
kalo vpn kudu ngikuti rule gin bocor data vpn mudah	negative
kalo urus cepat gilir data bocor sulit slebewww	negative
habis cek saldo mobile data beda nomor hape ya bocor langsung telpon scammer nyebut nama lengkap pakai alas ubah tarif transfer wow seram ya cepat	negative
10 ribu data laut bocor bertanggungajawab tanggungjawab	negative
