ide bagus but why stop therealat bayar rangkap ojek online rangkap remote tv lampu ac kocok telurjadi data bocor beli data keruk dana matiin ac bikin telor dadar	negative
deh keburu bocor kemana2 data pribadi wni brooohh	negative
kayaknya nipu deh data bocor ya	negative
bjorka data bocor tukang goreng nasi uduk	negative
dikroscek my order app kali ya lihat ticketing general sales kmrnada bocor data	neutral
asli sih bocor dukung manipulasi data suap rakyat	negative
satu2nya cepat uu data bocor hukum hacker bocorin data nasabah prioritas bocorin data anggota dewan suka checkin order2 kalo dinas	negative
njuk akeh banget radong melu nyebarke data pribadi jabat bocor ngeroso wangun kuwi mlebune doxing sono undang undange sih bjorka angel lacak radong gampang banget dilacake	negative
lihat story murz bocor data pln	negative
heran dunia digital data data bocor plat merah swasta ktp kakak mengintari bungkus nasi kucing ribuannegara lindung lindung aspaan	positive
tinggal negeri wakanda aman banget ya data pribadi gampang bocor takutdi negara gin sih	negative
enggak pernah mengasih diskon data bocor asu	negative
data langgan indihome duga bocor diperjualbelikan situs bjorka kominfo buka suara kena	negative
data shopee bocor iklan masuk wa ulah bjorka	negative
data pegawai bocor kemenkumham data krusial	negative
telkmsel bocor 1 orang gancoba deh cek bocor data menteri bpjs data2 vital bocor juta data marketplace	negative
grebek pinjol lintas yurisdiksi tabrak jazz putih data kpu bocor too many random things	negative
benaran sih takut data bocor	negative
agr data bocor prof proses langsung salam proses opd kontribusi sesuai kontribusi takut fitnah orang	negative
data pasien olah sistem milik menteri sehat duga bocor investigasi kait duga laku	negative
amanin data eh berantas nyebarinnya bikin ruu sih kemarin data bocor sebar tindak	negative
hpku tuh bocor kak kalo nyalain data wifi langsung habis cepat banget	negative
data rakyat jelata bocor identitas diblejeti sisi titik orang pedulimemang elit jabat sosok mberakyat peduli	negative
sakit hati tgh ganggu gler data bocor nih	negative
ketua komisi i dpr tindak data pln bocor	negative
data lu bocor pakai gaguna teh cocok pinjol	negative
bocor data didiemin sosoan metaverse	negative
lagisebanyak 6 juta data pasien covid19 bocor jual raid forumtahun data 13 juta orang aplikasi ehac milik kemenkes bocor 279 juta data bpjs sehat bocor narasi daily	negative
peduli sih hacker bluffing masuk data bsi ngancem nyebarin data fakta data konsumen bocor kemana2 konsumen digital	negative
alias bisabisanya data nasabah bocor orang kenal im considering close my bank accounthadeuh	negative
my evil mindkumpulin data bocor bikin personal orang sedetildetilnya korban	negative
system breach nya data karyawan bocor data nasabah bocordrpd komen nunjukin bodoh mending cari tau info ya minimal cek twit nya deh hihi	negative
data indihome bocor data pln bocor data polisi bocoritu hekel orang dalem	negative
halo sms mengatasnamakan uangme nomor hpnya personal uangme langsung nama uangme sms nya dipertanggungjawabkan ya data lender bocor	positive
data bocor tuh urus kerja kerja tri	negative
nih data duduk indonesia bocor kayak ktp alamat rumah kominfonya sibuk mengurusi blokir	negative
kayak takut data gua bocor foto ktpgua nya	negative
data bocor pw lemah db sedia layan bobol data2 simpan db ambil isi data2 personal ngaruh kalo ganti2 pw	negative
telkom data indihome bocor valid	negative
httpstcogutvx6onnnkominfo hacker incar sistem ecommerce instansi pemerintahada 47 jahat siber upa retas data bocor indonesia 2019 timpa sektor ecommerce instansi perintah	negative
hacker bobol godaddy data 12 juta wordpress bocor idn times	negative
kayak bocor data ya	negative
kayak anjir percaya gua ya jaga kadang pikir zip lock password pakai hidden file menghilangkan risk bocor data pap bocor tau gua tau	negative
ken ketawa fakta data bocor	negative
heboh data whatsapp bocor simak tips aman chat pakai aplikasi	negative
gue 2 telpon random nomor kenal dua-duanya sus banget gue tuh masuk coba tipu gue data pribadi gue bocor	negative
sih ts satire gongtp ya kelas tim hire tekan edar link tipu data bocor dipakek sih tipu kalo gaptek klik link uang hilang ganti alas user	negative
wkwkwk data pegang negara kagak percayamaunya pegang korporat negara amanin tara obvitnas gilir data pegang korporat bocor nuntutnya negara lamalama kayak mencari kambing	negative
nomor ku bocor ya tau nama pribadi asli data darimana bocorin	negative
lemah lindung kait data kemarin data presiden bocor aplikasi peduli lindung data kpai rp 70 ribu harga aman data anak	negative
oalah entar kalo data sih awan bocor tag ya	negative
kutip data litbang kompas rupa indonesia mei 2020 23 juta data pribadi warga indonesia daftar pilih milu 2014 duga bocor sistem informasi	negative
nooh data bocor nooohh urusiiiinnn ngurusiin slebeewwwwww	negative
data samsung bocor chatbot	negative
anon kali ya anon mencari mek wadon mah iya dewasa semenjak data bocor sembunyi identitas asli arah wajib susah sih kasih sanggah orang-orang aware private data breach kayak gin	negative
terang data pribadi bocor kaget rakyat kaget 3 nemenin teman cari kerja kirim lamar syarat cv enggak tau butuh kirim fotokopi ktp kirim 10 lamar ya kirim 10 fc ktp	neutral
iya gue stres memikirkan budget modal usaha sulit kayak gin data bocor ya gue pensi deh hidup ngidol gue rela deh kalo tuhan kenan temu langsung	negative
kemarin buka tabung salah bank situ janji point salah sedia data ke3 butuh promosi masuk suka bocor data	negative
pakar siber data bi bocor cabang bengkulu 20 kota	negative
well yaahdata bocor sih platform kena jenis ya kayak data dimanamana	negative
warga negarapengacara publik gugat lalai sembrono kelola kekuasaanya simpan data publik langgan data langgan indihome duga bocor jaja situs bjorka	negative
data peduli lindung bocor masuk pakai scan2 apps peduli lindung	positive
sorot juta data pasien duga bocor jual situs gelap tega hukum harap komentar andastreaming httpstcoen7fkcklp5	negative
webset pertamini dihack data lamar bocor	negative
waku suka dichat orang promosi sapa pakai nama username kupake akun tokped tau bocor data	negative
layan bri mantul habis sih oh iya bri komitmen infrastruktur jaga data nasabah loh aman hawatir kalo data bocor	negative
data konsumen tanggung usaha kalo bocor internal dul kalo curi ya usaha ecommerce tanggung tanggung batas cari bantu cari curi berkerjasama kait polisi	negative
data gue bocor manggil pakai nama alias	negative
data negara api bocor	negative
jiakkk jaman loh tanah data bocor	negative
wakil ketua fpks data kominfo bocor hilang percaya kominfo	negative
kemarin data sih plate bocor sih semuel bocor jugaternyata doi no hapenya 6	negative
ilustrasi dasar datadata ilmuwan nazi bocor data diam sekutu data simpan buah area khusus server khusus lindung khusus	negative
laaah kemarin daftar kominfo bocor kominfo percaya memegang data kalo	negative
data pribadi bocor ya tau-tau telpon ditawarin judi online	negative
juta data pasien covid19 indonesia duga bocor	negative
gawat 26 juta data indihome bocor nama nik	negative
sok data bocor few month back cover up bagus bank harimau nih	negative
bilang data bocor media sosial hoax mencari bjorka ketemu langgar uu ite data bocor valid	negative
data bocor	negative
noh data duduk bocor dimanamana noh	negative
nambahin enggak tau sisi positif negatif data bocor semenamena sistem bocor pegawai bocorin jualin forum kaaannn wkkwkw uang saku	negative
serius nihaku mencoba beli parfum via sop beli 2x 2 toko berbedalha nomor kenal menawari parfum via wasap toko2 beliini data nohp bocor sih	negative
komisi sekuritas bursa as sec sengaja data informasi pribadi tambang crypto bocor buah langgar undangundang privasi federalhttpstcoxfzyz0zxb7	negative
tokped bl data bocor heboh banget kominfontol sigap tau goblok data bocor heboh event minggu	negative
kalo nyata data warga indonesia bocor laku fs and the geng wew lihat background fs	negative
buah dokumen federal bureau of investigation fbi bocor datadata aplikasi pesan whatsapp imessage	negative
data bocor ya apps karya anak bangsa jebol topeng 3dkasian seller buyernya korban apps sedia layan tindakanlamalama premi asuransi plafon rendah buyer seller kena	negative
blokir hapus barang bukti data masyarakat bocor	negative
cyber war securitydari duit bank hilang data bocor hack etc agenda wef	negative
bocor data data habis bocor komenfoh maybe	negative
ramai data bocor server perintah badan jamin sehat perban peran badan siber	negative
komjen boy rafli indikasi dana otsus papua bocor kkb httpstcodlmxn8tv0o data tindak kkb senpi mudah tangkap sajam sumbar	negative
data daftar 13 miliar kartu sim telepon duga bocor respons menkominfo httpstcoajlahdkk6w	negative
data rakyat bocor statementnya jaga data gilir data perintah bocor panik bentuk tim khusus niat mengurus negara ya perintah	negative
dear oknum bni telpon data sebar bocor	negative
mbak nya gede buset banget ya bocor data	negative
toyota kena 215 juta data kendara langgan duga bocor httpstcopnuiyd68w9	negative
daya nik update data bocor kolom kerja update	negative
definisi data bocor sungguh	negative
alamat sentolo iya kayak data bocor tuh valid deh	negative
kalo posisi vital isi orang kompeten dikit dikit blokir dikit dikit daftar kalo data bocor ya mengbingung xixixi	negative
untung jenius jaga data pribadi transaksi aman teknologi kelas dunia loh data proteksi lap ganda bocor salah	negative
32 milyar data peduli lindung bocorpeduli lindung pakai cina india	positive
olah data pribadi jalan perintah khawatir data bocor data pedulilindungi	negative
1 nomor recycle 2 data id bocor internet 3 aplikasi judi akses kontak user teman instal eh nomer scan	negative
bocor data kayak bahaya bahaya tradisi ngeles sikap mengaku jabat klaim kalo bocor httpstcogrum1djxe0download aplikasi httpstcoo5tgxcaaqv	negative
tolong milik tagih shopee paylate laku transaksi tolong solusinyadan tolong data pribadi bocor	negative
data sim card bocor media main blender menkominfo johnny plate dibuli warganet	negative
mendownload tutorial mobil data bocor	negative
gila ngeri data bocor manamana	negative
data bocor telpon tipu kadang kayak solat wajib 5x	negative
negara peduli data warga bocor diperjualbelikan peduli data warga kontrol utama merekamereka coba bangkang heran aksi doxing laku intelejen	negative
data duduk bocor kali kalo kayak urgent my expectations were low but holy fuck	negative
data nasional bocor berkali2 sasar empuk	negative
senang senang nang data bocor	negative
syukur kalo legal kolom rep download app nya data bocor app sus gue btw thank you informasi	positive
26 juta data anggota polisi bocor polri hoaks	negative
system jaring aman data data bocor system aman bangun lemah perang cyber	negative
server tiktok rawan bobol data 1 miliar ancam bocor	negative
data elektronik bocor memiara robothadeeeh	negative
parah data warga indonesia bocor	negative
enggak bisa ss data bocor ss data aman sedih sih	negative
sah ruu pdp uu harap publik jamin aman data pribadi warga negara bocor delik hukum data pribadi identik asai negara kuasa salah	negative
min kantor kena tipu pas pasang wifi indihome gegara data nya bocor 3 nama indihome bisa2 nya data costumer bocor	negative
johnny tolong koruptor kasih hukum mati ya doyoung data duduk bocor	negative
pakai vpn pakai bpjs aman bu data bocor tuh kemarin	negative
ooo iya enggak punya ahli sungguh-sungguh bocor mencari data scribd	negative
bocor data ribut bocor kas negara gondol maling mingkem	negative
sepakbolasolusi data negara bocor kalo serang solusi minyak goreng rebus solusi tragedi cuman bacot moga fifa hukum desak mundur bacot orang bebas opini	negative
surprise ultah bbm data kominfo bocor mending moco majalah bobo wae moco artikel sing mara emosi	negative
pishang mat rockstardata gta 6 bocormember tgh develop game masak masak	positive
mengecek data bocor gaiss	negative
aneh bin ajaib data bocor manusia tanggung jawabanya	negative
kabar data bocor	negative
data intelijen rusia bocor putin idap kanker pankreas parkinson stadium	negative
data bocor	negative
nih fokus benah sehat ngadi data bocor mari kagak menambah	neutral
modus baruuuuu nih biaya admin jadikan tagih direct debit 1 data nasabah bri bocor 2 kalo bocor pas wa nasabah aman perhatikan bnykin nasabah	negative
wa asing sms nomer asing mengatasnamakan pinjam saudara kena celaka data bocor buruk jual darkweb	negative
data bocor bayi gaes	negative
tuduh tppu ya investasi lapor kpk bingung gue bgm kalo dana jahat mengalir pakai sumber dana invest darimana data bocor data milik	positive
ganti rugi woi ganti game gue beli enak blokir kagak pakai mikir tau market digitalkementrian urus tuh data bocor scammer mengurusi kayak bokep dirusin	negative
13 miliar data daftar kartu sim duga bocor sistem aman kominfo sorot	negative
kade data pribadi maneh bocor daks	negative
telkom data bocor data milik indihome duga hasil rekayasa	negative
pokok data bocor	negative
senyumi nyata data perintah data bocor	negative
data bocor ya lahir kemarin	neutral
rem banget sih data lu bocor woyy	negative
sih aneh banget mentok data bocor sistem ordal nihhhhh	negative
bubar anjir lu ngejamin data aman gilir bocor lari tanggung	negative
data petinggi bocor publik urus ya	negative
asik siap2 data bocor mypertamina	negative
semenjak hp copet was was banget takut data bocor blokir ganti password rada ngeri	negative
parah data bocor	negative
bayang gue intel teh jiga 007 eggsy keren teaeehhh bin nyamar mengaku data ge bocor ambyaarrr	negative
tough times never last but tough people donetizens gue the problems bbm maling2 bebas data siber bocor rakyat demo bu puan happy sambo gudang skenario masamasa sulit landa tips tahan guys	negative
tau kalo data bocor ditelponin telemarketer berkalikali share nomor telepon arti bocor data at least nama no telp	negative
marak data pribadi bocor cepat niy uu pdp	negative
11000 data mohon bocor uitm mohon maaf	negative
sok-sokan aman data ktp duduk bocor kmn2	negative
lucu ya appnya takut app takut data bocor	negative
tau kominfo nya blokir blokir doang gilir data bocor atasin	negative
aneh sih data bocor hacker sibuk benah aman sibuk melawan hacker bikin tim khusus	negative
takut bocor connect internet risiko data breaching sih sad	negative
kaya gue nder beda gue mah shopeepay latter kntlpdhl gue memakai data pribadi bocor nder	negative
bbm pas pagi pasar cabe info data bocor maha ceunahhhh	negative
fakta data e ktp bocor lindung daulat sih jujur deh ngetweet gin bayar rela bodoh gin ya ampun	positive
oalah data bocor pansos	negative
lepas isu time management lihat positionnya analyst analyst analyst rekruternya takut resiko data usaha bocor gue startup kerja pakai laptop pribadi antisipasi bocor data intern wfh pakai laptop pribadi sih	negative
halo min selamat pagi asep gin ngaruh ya rto min takut data bocor mohon info	negative
nyata data bocor ges	negative
biarpun kasih ccv lapor call center cc blokir data pribadi bocor harap sih laku tipu tindak ya	negative
bank cpns kemarin bocor data kemenkumham hack download situ	negative
komisi lindung data irlandia jatuh denda bocor data 2021 data 500 juta fb bocor	negative
enggak pernah pakai produk ponds men enggak pernah registrasi nomor website tau kalo pegang nomor laki-laki ya tau drmana salah efek data bocor	negative
wang bikin ajak negara mysejahtera kecam rakyat data bocor selesai ajak negara menampak universal situ menampak bijak situ puihhh	negative
rem banget ya data bocor tenang takut data disalahgunakan	negative
data registrasi sim card bocor data milu bocordan jabat anak buah pecat sibuk melawak otp serang siber dsb ketidakpahaman	negative
cepat digitalisasi tanda bikin aplikasi paham hasil data pribadi bocor simple bikin aplikasi harga aplikasi akam variatif harga parameter	negative
data institusi bertangungjawab mencak hoiirakyat gugat perintah data rakyat bocor	negative
data 94 usaha ri bocor sanksi tegur	negative
big data malaikat ridwan bocor maaruf amin	negative
maaf kak data negara bocor kak data ektp data vaksin data perban data kelas megawati bocor kak	negative
poin bos data bocor kendali selenggara sistem	negative
data bocorpalingan orang bocorin	negative
mah data bocor internet lot lot habis bayar bikin speed normal menunggu tanggal 1 gila sistem kapitalis	negative
bocor data lindung negara httpstcojymybzoshf	negative
ehmdata pentagon bocor	negative
ite t e nya transaksi elektronik jarang banget transaksi elektronik perhati data bocor pinjol masuk transaksi elektronik	positive
data bocor duit blt gondol maling	negative
tuh bilang anak titip lihat banget begonyadata bocor jual sorot malu institusithey are not clown but the whole herd of donkeys the circushttpstcochjthdztib	negative
masuk masuk grup 13 milliar data bocor 3	negative
data bocor ujung dijadikan deepfake enteng hidup paham jabata privacy digital level 10 lagak teknologi asa tony stark	negative
26 juta riwayat browsing indihome duga bocor nama nik langgan kalo data pribadi retas tangguh serbaserbi mmc httpstcoyhbkxhixst	positive
pikir kalo data ktp nik kakak dah bocor gampang bobol rekening	negative
pinjal pinjol kasih temenmu kontak kalo lu bayar kena teror bilang sori data gue bocor ah emboh	negative
maksud data bocor	negative
enggak tau data nomer telfon bocor tuh sms spam eh akhir2	negative
isu 26 juta riwayat cari nama nik langgan indi home bocor gratis situs gelap hmm data pribadi retas pandang islam simak serba serbi mmc inihttpstcoiusbx7tfkq	negative
data bocor harga bbm anjing banget sih pusing ken pindah negara	negative
naah potensi oknum nakal ya bocor data pinjolmulai sales sd back office proses aplikasi oknum nakal	negative
dagel data bocor benah sistem aman siber blokir situs bocorin kominfo nih tau peribahasa jalan tuju roma sih	negative
awas data kantor bocor	negative
ya utek pakai pikir waras kalo gulai sdrhana apapunlah informasi anggap rahasia bocor periksa institusi datainformasi	negative
sigap lapor duga data bocor pln tanggap kominfo	positive
kalo jarang on hemat baterai baterai gua deh bocor matiin data biar awet	negative
menteri kominfo panggil bank jatim kait duga data nasabah bocor diperjualbelikan forum hacker bank data bocor data nasabah	negative
mhn maaf dok bocor data kemarin2 tangan lempar tgg alhasil data warga negara bocor sistem aman data digitalisasi data sehat	negative
warganet peduli cari nafkah ketimbang ngributin data data bocor dijualin ketigabnyk banget freelancers hidup benar-benar gantung paypal mrk2 suruh mampus gitumain blokir2 solusi kntl	negative
bocor liput data pribadi nik user id password nomor ponsel lainlain pandang islam kaffah kait lengkap editorial bocor data lindung negara	negative
data bocor halus 2020 salah merchant awokwokwok melawak	negative
mohon siasat hadap laman web papar bawahjuga siasat sekira data peribadi bocor modus operandi tipu cakna	negative
komitmen cipta layan produk digital bri komitmen tekan proteksi kuat hadap data nasabah infrastruktur lindung takut data bocor	negative
amanin data biar bocor kelar perkara bjorkabjorka an	negative
data bocor providernya telkomsel banget sms telpon ampas	negative
487 juta data whatsapp duga bocor data indonesia	negative
juta data pasien rumah sakit indonesia duga bocor kemenkes telusur	negative
kamilalu data bocorpegawai sangkut pecat itukalau bilang transaksi laku sepakat bersamaanda konsumen langgan erti orang tua tau marah orang tua salah tau	negative
data pribadi bocor nikita mirzani bongkar identitas bjorka nyebarin nik ktp bangga	negative
data nasabah bocor ya 1 kantor kabeh kena telpon hmmm	negative
kayak data itb bocor	negative
beda mobile serang spesifik bsi serang korporat duit hilang data pribadi bocor identity theft batas	negative
data nasabah bocir sebentar privasi pasien bocor set banget lo salah instansi guru perban dokter masuk jurang sih ya	negative
kaiselama bumn berhasil rebut hati rakyattolong timbang ide httpstcogxdh4vqmv6 uu lindung data pribadi konsumendan data pribadi bocor alasancaranyatolonglahberpihaklah konsumen	negative
bbm data bocor pergi2 scan apps mending pelihara burung puter warna isi libur hemat happy bikin stres httpstcoafciikmaozciwen gaji 6 thats dream mas jungkook hes real giselle reza arap	negative
eniwei berita data bocor penasaran nama menteri plate baca plate plate	negative
menari nang i miss dancer hoony too much takut bgtjgn data bocor ichi ganti pword	negative
data pribadi bocor salah is another asshole	negative
sender benernya data bocor ya	negative
bbm inflasi data nik bocor loh sempetnya ulang rayain gedung rapat aduh konoha kayak gin	negative
lidah tulang nyata jamin konsekuensi ya data bocor sih jamin wajib mengasih ganti rugi 200jt milik data	negative
pln ban bocor data 17 juta langgan terap sistem aman lap badan siber sandi negara bssn	negative
data bocor email pribadi karyawan hyv key api config kodingan databasenya wkwk bilang leak rem securitynya	negative
data indihome bocor 26730798 data langgan indihome ekspose	negative
metaverse metaverse data bocor noh	negative
mercusuar dunia data pribadi duduk wae isih bocor njuk piye	negative
tenang bocor data aman wkwk	negative
kadrun zaman primitif apk jaki warga jakarta apk jaki responsif data lapor bocor warga gaptek puas bebas lapor kendala alami langsung pemkot nya	negative
kominfo selidik duga data indihome bocor	negative
kalo bocor data kayak data bocor gue telpon sales asuransi tuh nomer gue	negative
resafel pas menhan tangkap 1 kapal asing hutang ri numpuk menkes ahli menko info data presiden bocor yasoana lalai nyawa layang 40 big bos menjd panutan bangsa 12	negative
bahaya aksi bjorka data bocor tipu hasil uang pinjol	negative
data bocor komisi i dpr audit lembaga menteri	negative
kacau nih rumah seberang laut nih ya kalo dar nyelametin muka tahap pecat tuh menteri bikin data pribadi orang-orang bocor cor cor	negative
server kemenkes duga bocor data identitas enam juta pasien bocor httpstco0ncr0sttac	negative
kalo gin bocor data negara model bikin damai	negative
data bocor anggap bahaya sih	negative
i not gon nya invalidate your feelings but an insight save nomor orang nama lengkap keluarga sok alas data hape bocor orang retas susah cari kirakira hubung	negative
data langgan kabar bocor pln replikasi update juru bicara kominfo dedy madi telusur duga bocor data pln	negative
bocor data	negative
tolong data bocor	negative
data langgan asset2nya pln rame 1 usaha kalo data assetnya bocor gara-gara habis migrasi ya	negative
gue pikir orang kemarin akting layar kayak sanggup ya ngelindungin data bocor kuat sistemmukanya kayak belagu banget ya i mean there is no chance you could defeat bjorka without recruiting another bjorka never	neutral
hhmmgayamu minntar dmditanya nomor brpposisi dimna alamat kota camat lurah rtrwdata rekam situ rahasia identitas identitas giat sosial deny siregar bocor ujung-ujung nya ya solusibasi min	positive
hoax data polri bocor	negative
tulis sok cerah nyinyir bukti data laku crosscheck data database banding data kominfo provider dll persen benaran bocor tau bocor database	negative
4 bang anies baswedan jakarta tingkat macet turun awaaasss data bocor psi	negative
dinu enya nage nego angger weh data aing geus bocor ti perintah keneh sih	negative
data kpai bocor jual murah rp 35000 data	negative
data kominfo bocor suruh ganti password cerdas	negative
mahfud md klaim data bocor hacker bjorka tunggu httpstcosk0j7fnbov	negative
negeri lucu data bocor bela bocorin data	negative
ok bong ted anggap anis korupsi lo komentar bajing maling gerombol lo malu takut kasih duit tuh data base bocorloe komentar sengaja data base rakyat obral 2024	negative
polda metro bocor data polri hoaks httpstcobb8lo7b5wu	negative
data bocor wkwk otomatis wkwkmiris panik mojok data pribadi pakai pinjol	negative
du chat ditelfon orang curiga orang rusia kanada data bsi bocor ya	negative
indonesia1 wig juta data bocor jual forum hacker 3	negative
cuirga sih gertak kalo ane baca ngelindungin privacy tanggung kalo daftar data bocor ya google meta platforms rusak privacynya fb data bocor 500jt	negative
inforakyatkini laman web dakwa bocor data peribadi rakyat malaysia more httpstcodvz1ehtx5l	negative
iya hati kalo data alamat nama bocor parah	negative
hatihati main media sosial data pribadi bocor	negative
khawatir data bocor mah aman	negative
data bocor gasetiap demo 3g sudirman thamrin collapse bayar pakai qris gopay nyangkut	negative
wakil telkom group nyata datadata indihome duga bocor valid	neutral
bocor data maaf kerja denial doang improvement data bocor menteri kerja sih	negative
perihal data bocor kuminfu project project	negative
urus data bocor ambil pusing nama indonesia data bocor wkwkw	negative
data bocor kayak indonesia kagak puas kali kali kawan	negative
data 46 juta nombor telefon bocor komputer riba tumpu siasat httpstcovyl4ybynzm via	negative
adek gue aman temannya kena hack data bocor hilamg akun gue uninstall	negative
gilaakkk telepon nomor kartu 3 dipakai orang enggak usah deh mengomong metaverse metaverse kalo data bocor	negative
wenang aman siber kecuali aman data digital indonesia tangan masuk data pribadi warga indonesia bocor tugas pokok fungsi terap hukum kait lindung data pribadi	negative
ah bocor data yaelah orang data data pikir salah pikir pasrah jaman data gimanapun waspada	negative
kalo buzzer bang bela kominfo segitunyaini sekian kali loh berita data bocor dibenerin mengapai kerja ngopi makan tidur main billiard	negative
aman data diperbaikin rawan rawan nya pinjol penyalahgunaan data kadang data bocor ngebuat masyarakat susah percaya apps moga kualitas rambah super app	negative
puan desak perintah audit aman siber httpstco1zbpy5mknx	negative
berulang2 kebocoran247jt data nik bocor bpjs kesehatanbilangnya data bocor	negative
isu data bsi bocor lockbit duga uang tebus rp 295 miliar	negative
konsep digital layan eh data bocor mbelegedez	negative
data is the new oil kali bocor mulu oil nya coba mesin cek janganjangan turun mesin	negative
