iya kayaknya deh kak soalnyaini tuh gegara data bocor rame kemarin oknum jualin data netizen kayak kak threadnya resah banget sih ganggu abai sihmemalukan banget	negative
orang sibuk memikirkan data bocorini nyebar	negative
tranding tau data nik data indihome data duduk data kpu bocor 13 milyar data jual dark web	negative
anjir lucu banget situs hacker bocor data pln daftar pse kominfo blokirbenerin bocor data blokir informasi data bocor data bocor rakyat tau	negative
april 2021 data pribadi 130000 gun facebook indonesia duga bocor disebarluaskan buah situs retas amatir	negative
data pribadi masyarakat bocor	negative
data mysejahtera bocor kali terima	negative
data bjork data 2021 booster hacker daur ulang bahan2 bocor sebar dark webbukan arti data security klaim bjork klaim basi	negative
stl baca thread duga a data a sih bocor manfaat b b pakai data beli baju kirim sih skema cod sih terima baju paksa bayar kalo bayar duit masuk b kalo dilaporin email telusur a a kena	negative
menkominfo data kartu sim bocor bssn httpstco7q05keawm7	negative
man data telkom bocor gara hacker lokal	negative
tau gampang banget ya data bocor planet namec	negative
ektp data bocor	negative
google gegara data pribadi bocor	negative
bocor data ku	negative
kominfo main sengaja bocor bocor data ketat pse hujat	negative
kalo cetak nder untung suami kerja cetak gatakut data bocor	negative
kominfo panggil pln duga data bocor	negative
data duduk bocor ngaruh ya ngaruh hasil milu tinggal bikin menang kalah	negative
tugas sensus ya taujadi takut nih kalo data bocor	negative
data presiden bocor masyarakat	negative
5 tips aman lindung data pribadi biar bocor dunia maya	negative
deh heran data warga ri bocor gampang bobol websitenya data transparan urus urus ktp indentitas	negative
nama ana nama profil arumi ngehack data bocor nih	negative
negeri ku lucu tru kalo data rakyat bocor kemarin lapor	negative
mengurus spam sms data bocor enggak usah lang jauh2 kecengklak entar	negative
deh kadung bocor data registrasi 4444 deh gondol tinggal tunggu momentum tagih pinjol	negative
bang please materi komodemenoi diselipin data bocor lucu banget gemas ketawa2 bjorka share data bocor haha	negative
bukti kalo data bocor	negative
laiya ya rakyat capek capek byar pajak ngegaji harap aman data data bocor becus kerja	negative
susah beli 1 suruh fotokopi data bocor manamana fotokopi dijadikan bungkus goreng minimarket	negative
layan adu kpai ganggu data bocor	negative
peduli lindung kena hack 32 milyar data pribadi peduli lindung bocor nyata enkripsi sample bjorka contoh data johnny plate luhut bisar p deddy corbuzier	negative
distopia sih lindung data pribadi aman siber indonesia buruk banget data pribadi warga bocor sedia olshop data warga kelas densus 88 antiteror bocor kayak gin mengomongkan metaverse	negative
data pribadi orang suka jahat siber data jual data manfaat data keuntunganlalu password email bocor retas	negative
kayak nya blok deh wa chat chat nomer pakai nama username toped toped bocor data darisana	negative
rem ya data pribadi masyarakat indonesia bocor dipakai giat kriminal internet	negative
berita data jebol web resmi tau data bocor salah bkalapak tkped anjur ganti psw	negative
berita kena juta data langgan pln duga bocor jual forum online	negative
data masyarakat bocor data bocor biar adil	negative
kacau men bocor data	negative
iya gue stres memikirkan budget modal usaha sulit kayak gin data bocor ya gue pensi deh hidup ngidol gue rela deh kalo tuhan kenan temu langsung	negative
perintah ngelanggar atur ya tri jaga rahasia data data jebol salah timbang aplikasi daftar takut bocor data customer	negative
subsidi bocor cabut data bocor wajib isi data cabut	negative
mahfud md data bocor informasi bocor hacker bjorka data publikasi mediamalah ketawaketawa	negative
data nasabab bsi bocor	negative
bocor data pribadi masyarakattersebar isu 26 juta riwayat cari nama nomor induk duduk nik langgan indihome bocor gratis situs gelap httpstcoohf5ojfqah serbaserbi mmc data pribadi retas	negative
klaim data bocor kominfo audit 13 miliar sim card edar internet httpstcolked7e7f8s via	negative
kalo blokir blokir kalo bocor data sim card bocor keluh gegara keluh	negative
laku data bocor	negative
paksa daftar pse data bocor jenis lengkap ayo kominfo peduli keman data benerin	negative
data 215 juta milik toyota bocor internet serang hacker	negative
data negara bocor mahfud md bjorka mengarang sebar	negative
indonesia starts when lurah ask you fc ktp deh bocor deh data	negative
berita kalo bunuh selingkuh data bocor huft	negative
data indonesia sih bocor	negative
kalo bocor ya kalo tau fw kalo daftar pesimis bocor data ge rakyat ya gue gapeduli peduli data gue bocor cuman nomor tipu doang kontekin	negative
kagak data perintah ya data ecommerce ya perintah sok ngadingadi internet data bocor mulu gara-gara arsip lurah fotokopi ktp kakak mulu orangorang goblok ya	negative
telkom group klaim data duga bocor valid alias hoaks	negative
kena pasal cemar nama bain sih polisi bilang bocor data like come on gin beres ngeharep isilop	negative
juta data pasien covid19 indonesia bocor httpstcophupn4tdst	negative
data pribadi bocor erick thohir rangkul hacker bjorka jalin kerja perintah httpstco9momyie7if	negative
menteri tau jalan rusak langsung aspal data bocor blokir sih hacker nama hacker woiy buzzer pinteran dikit	negative
database rawat data bocor sibuk blokir shshshshshsh	negative
paypal bawa paypal serahin data user 9999 bocor lu isi air ember lubang benah atur aman pse platform gede registrasi	negative
kompas data pribadi bocor	negative
dapur harga minyak goreng lejit buka dompet data nik bocor garasi pertamax 2x menonton tv menonton boo gin panitia wakanda wkwkw	negative
data bsi bocorsimak lengkap httpstcoqdtczrbpso	negative
data warga tiongkok bocor internet	negative
linknya kalo suruh memasuki ktp orang data pribadi lupa kasih watermark ya biar kalo bocor tau	negative
panikkk ygy perintah indonesia collab buzzerrp menyerang	negative
waspada banget kalo upload dokumen hubung data pribadi eh rupa bocor wkkwkw	negative
data tau bocor dih data baca	negative
data kpu bocor 105 juta data pribadi pilih blo	negative
jalan pas sih bjorka bocor data presiden pas data warga negara bocor tanggung hilang kecewa	negative
teruk law pasal data proctection kat malaysia sok kali hairan kes scammner kesi kat rakyat pulas keringat penat lelah kumpul duit last2 kena scam data peribadi bocor	negative
takut data rahasia koruptor bocor publik	negative
asang aseng asang aseng idih kayak marketing indonesia tukang sebar data gue memakai app kayak amino gue bocor data gue memakai ojol deh data bocor kemanamana	negative
data salah oh nyata oh teryata kelola data bocor badan siber sandi negara menkopolhukam entar sumbang aquaproof rapet	negative
data warga ri bocor platform digital denda pidana	negative
video 6 juta data pasien covid19 bocor jual online	negative
bocor data nya owiemang isine kasbon wae	negative
tweeps jual online minat gegara info data pribadi bocor ya allah ngerugiin banget jual amanah	positive
jelas-jelas gue bahas mslah refund uang membership buddy data pribadi bocor eh orang tolol fandom lu bilang menghina gfriend lu tau bilang gfriend dibubarin orang album fisik rendah pamer po album sera tembus 200k	negative
kalo bobol akun pakai otp nomer hp ya data nama no hp alamat bocor	negative
data bocor bocor sengaja jual sih	negative
kalo sisi bikin data bocor contoh ya kak awam	negative
bocor data lu foto copy ktp kartu keluarga	negative
pks semprot menkominfo data ehac bocor kemarin httpstcoracsz2rekr	negative
sorry oot data membership buddy bocor wevers	negative
ponsel muncul fiturnya deh bolakbalik uninstall download ambil hikmah data pribadi bocor mengikuti trend	negative
lihat data bocor sih	negative
lawak banget nih negara data bin bocor	negative
gila wkwkw data bocor gin nya	negative
hujat suruh benah tindak sih data bocor ulang ya rakyat indonesia rugi pse nya dukung pandang	negative
mengurusi data bocor berkali2 becus anggar ditanyain teknis paham menambah anggar masuk perut hasil	positive
data bank indonesia bocor desember 2021 bssn	negative
data bocor gin sumber pegawai sengaja sih modus	negative
teledor data pribadi bocor tindak	negative
wkwk anjr puja perintah biar merasai sih data bocor	negative
data bocor ya	negative
kerja min data bocor dimanemane	negative
perlambang data bocor kemarin	negative
httpstcoli6qj43qwz stop being an idiot data bocor tugas kominfomenkominfo merespon pesan sudut menteri pimpin	negative
ya makan lu kali mengetik mikir kayak gue sekolah awat kerja rs gue resign rs data pasien bocor orang sekat gue lu mengetik sosmes bawa mati sopam gina kayak tuh	negative
wkwkwk asai maksudnya piye bukti kadrun nih kalo mengoceh pakai data santuy sampeyan anak kondom bocor	negative
sok privasi deh data tuh bocor	negative
rahasian rahasian data bocor lambat jual bebas indihome bangsat	negative
bocor ya paket data kadang kontrol top up game nominal tumpuk mesti	positive
yeap this is what i mean daftar kartu prabayar memakai nomor kakak seinget gua alas lindung data nomor bocor admin slot pinjol judi	negative
gawat 54 juta data twitter lapor bocor	negative
data takut bocor woi telor data peduli lindung bocor data presiden konyol	negative
takut bocor connect internet risiko data breaching sih sad	negative
negara semrawutsalah uruskahharga minyak dunia turun bbm subsidi polisi tembak polisi bingung publik proses isu konsorsium 303 13 miliar data bocor wacana 3 periode salah uu dibiarkanibu pertiwi jerit	negative
registrasi data bocor lawak	negative
bilang data valid sebar tanggung orang-orang data bocor	negative
kalo daftar pse situs forum blokir data bocor diperjualbelikan sek sek piye	negative
orang-orang duli manusia jual data2nik kkbuku induk duduk trsebut act kartu hppinjolprakerjaewalet dll nama daftar prakerjasusah reg kartu max arti fix data bocor	negative
kpu nilai data bocor kes mengadaada	positive
teliti aman siber teguh aprianto tim periksa data gugat bocor 279 juta data bpjs sehat adil 279 juta data duduk indonesia duga bocor jual forum retas raid forums 12 mei 2021	negative
bocor data	negative
data nya bocor negara salah	negative
iya sih kominfo sampah ya santai kalo hacker pura spill munir pertamina dll habis diapakan data bocor takut	negative
saking pinternya aktifasi sim card wajib pakai ktp giiran dtaa bocror tanggung nyuruh pakai data priibadi bambang server diaalaahklo bocor salahintrus menuntut rt	negative
mending urus noh data nik bocor	negative
pabila data peribadi bocordicurima746092019 mycert advisory security best practices on data breach incident	negative
scam ngeriii nomor hp bocor manamana jerman isu data privacy nya	negative
data bocor	negative
kemarin lazada sih nder beli headset jbl discon gratis ongkir biaya tangan sepupu bikin rada ngeri data bocor data bocor ngirimin baju haram beli	negative
data pribadi lo nder lo hak pilih kasih tau potensi disalahgunakan kalo mah lo rugi gara data pribadi lo bocor	negative
data amal lu bocor lihat tad	neutral
bangsat kominfo isi boomer steam tarik pajak beli games 10 blokir cokk slot online kagak kontribusi pajak diam bae data indonesia bocor diam ban kominfo anjg	negative
bpjs data kpai duga bocor jual raidforums	negative
kominfo remeh urus data bocor geming	negative
rusak gara gara data bocor	negative
kalap perkosa kumpul data pribadi lindung data pribadi disalahgunakan bocor	negative
beda kominfo pakar data daftar kartu sim bocor 100 valid	negative
jokowi bocor data orang presiden bocor rakyat bocor data tanggung laku jahat perintah indonesia tegak hukum ruu pdp	negative
bahaya nya data bocor sih bang teman gua gua	negative
puan maharani khawatir data pribadi masyarakat nik npwp bocor proses integrasi dengar aspirasi rakyat	negative
sadurunge iki data indonesia wes bocor mergo apk pedulipeli	negative
pse data bocor	negative
marak data pribadi bocor cepat niy uu pdp	negative
jaman wan got warga lapor jaki intimidasi data warga bocor kerja wan got ngibulnya	negative
bangsat indihomeudah data bocor mahal malam jaring bapuk	negative
data nasabah bocor	negative
sih hacker inisial b balas dendam kominfo stop orang nih kasih nih masyarakat indonesia korban data sim card bocor ulah sih hacker	negative
langgan setia 11 data bocor beku nomer nama ganggu banget sumpah notif aplikasi web	negative
iya memikirkan customer memikirkan kalo data menteri jamin data amanga bocor kelas vaksin data ktp bocor	negative
data nik bocor kemarin ya	negative
nik unik duduk pas banget primary key data nyangkut duduk orang-orang mikir enkripsi nik tulis database biar kalo bocor vulgar2	negative
ah kagak deh gini2an bikin uunya uu nyata uang fisik kertas sahbelum data bocar bocor kagak jelassemudah kagak deh digital2an	negative
pindah lord luhut besok langsung geger data bocor ya tumannn	negative
data bpjs bocor data tokped bocor main ig takut kntl	negative
dokumen internal manajemen facebook bocor media temu data alami problem depresi ganggu cemas akibat buka ig httpstcoanyctla84p	negative
tipikal sih den kalo tau orang somasi habis2an telkomsel data sih den bocor kagak sok tenang mencak2	negative
email nik data simpan rapi perintah bocor heran security data mbuhmbuhan	negative
data bocor maling ketangkep caleg nyoblos dukung partai teruus netral ancam ancam teruus	negative
rekrut ahli usaha telko plat merah doi temu celah n doi bikin kuat data bocor kasih gaji doi minat join	negative
iya deh iya data bocor salah gue salah teman teman gue	negative
aware sih app percaya kalo registrasi syarat foto ktp selfie pakai ktp hati-hati data bocor pijol	negative
2 isi data tau bocor	negative
lanjur data orang indomah gampang bocor kali	negative
perintah tolol over anying borong data bocor jaksa suap koruptor bebas demo surprise ultah kayak brow aing capek musti hina mane	negative
data peribadi 22 juta rakyat malaysia bocor1 dakwa ranah jpn kesah terima lapor hubung dakwa jual pangkal data kandung juta maklumat peribadi rakyat malaysia buah forum pasar pangkal data kenal	positive
modus baruuuuu nih biaya admin jadikan tagih direct debit 1 data nasabah bri bocor 2 kalo bocor pas wa nasabah aman perhatikan bnykin nasabah	negative
enak mamam tuh tri lawak data lu bocor	negative
sulit perintah maaf bocor data hubung tanggung	negative
13 miliar data registrasi kartu sim duga bocor data valid	negative
tunggu bjorka tangkap data bocor kalo ksmungkinan kalo bocor malu antartika	negative
serius cari arti negara bocor data bocor negara anteng	negative
percaya data bin bocor ya awikwok pure paper based kalo dicopy hilang kakek aing mesin fc annya rusak server dipakai pcare kemenkes backup pl kalo info anggota mentok ya superficial doang	negative
gue manja berani hitam putih kalo data usaha bocor gara-gara gue gue wafat jalan masalahjatuhlainnya gue bukam anggota organisasi	negative
dih bacot banget deh data lu bocor ganti password menit	negative
iya ya lupa kalo data buddy bocor sih	negative
mudah nk faham data bocor	negative
data rakyat bocor sim card aman rakyat lindung serbaserbi mmcmiliaran data daftar kartu sim alami bocor forum pasar gelap kominfo tampik klaim bocor data internal menteri httpstcozzwqbh91yy	negative
urus data warga bocor	negative
kerja mengapai sih data bocor kayak ku beban orang tua parah nyata kominfo parah beban negara	negative
baca data bocor 2018 arti riwayat pakai aplikasi aktif 2018	negative
argumen nya bagus kalo lihat sisi investor mencari untungcapital gainperusahaan investasi sptnya peduli harga data bocorcmiiw	negative
bjorka indonesia bocor data pribadi 2019jadi rupa timbal runyam politik indonesia seru tonton and lihat skenario gagal negeri	negative
kominfo laku lidi kait duga data langgan indihome bocor	negative
data intelijen bocor sakit misterius putin bongkar httpstcocad3hzpnji	negative
data milu 2024 bocor polisi duga kpu sanggah buah video	negative
belanja dialfagift pegawai alfamart mengantar badang nyuruh bayar data mes nama nomor arti data bocor pakai orang ya akun nonaktif	negative
data bocor cek ya guyssoalnya nih wa nomor gadikenal menawari slot deh	negative
data sih bocor thats the real question	negative
data sim card bocor cek	negative
benah sistem masyarakat bocor data hukum penyalahgunaan curi identitas ektp bocor bjorka cuat	negative
data nama intel badan intelijen negara duga bocor bin klik baca	negative
data rakyat bocor sim card aman rakyat lindung serbaserbi mmcmiliaran data daftar kartu sim alami bocor forum pasar gelap kominfo tampik klaim bocor data internal menteri islam pandang b	negative
halo data masyarkat bocor kasih dana cuman ngles ngles	negative
jangkan rupiah digital beh data masyarakat brantakan bocor tanggung ruwet	negative
data pribadi masyarakat bocor	negative
syukur data nasabah bocor ketat aman	negative
data toko publik data pribadi rakyat bocor anggap ya bos siyaaaap tau dah kualitas hahahaha	negative
tau sih coba takut aman takut data bocor dll	negative
bank mandiri oh bank mandiri data bocor bank mandiri orang aju kartu kartu kredit mandiri visa gold master card skyz accepted bank mandiri	negative
blunder banget sih lindung data pribadi bilang bocor ya enggak apa-apa deh heran banget jabat negeri wakanda wkwkwk	positive
denny siregar doxxing identitas polisi cari dalang data bpjs bocor polkis	negative
data konsumen toyota asia oceania kabar bocor nama milik jenis kendara	negative
pesan kominfo data bocor memilih mengurusi blokir slebew	negative
bangkee pilpress bbm isu bocor data duduk baca tanda tanda	negative
kalo logika deh bocor data orang nik coba pikir deh no wonder they called you buzzerrp	negative
didu main kata-kata bpk ex jabat paham otoritas kominfo rakyat patuh instruksi nya kait kumpul data pribadi rakyat kumpul data bocor mesti pakai didu suruh mundur orang	negative
biar diam kayak data sim bocor klarifikasi sampah	negative
malam kabar ges gin semangat yaawjasa transkrip verbatim buka loh libur buka ngerjain sen enak nya tuh privasi aman data jamin deh enggak bakal bocor kerja cepat	negative
bising data bocor	negative
kalo jaman keluarga susah percaya jaman data pribadi bocor	negative
mas kalo lihat data dipublish lockbit darkweb asumsi pribadi kena salah user 1pc bsi sistem bsi bocor data2nya ya	negative
bocor data indonesia bocor data pribadi sektor swasta lembaga negara alhasil datadata bocor diperjualbelikan dunia maya	negative
nih bikin gue insecure hal-hal bau fotokopi ktp urus tau arsip kayak kalo kepake musnah berkas kayak ngeri kalo data pribadi bocor gin bikin ngeganggu	negative
group telegram bjorka data politis bocor	negative
balut jarang bocor data negara bocor mulu	negative
aman data pribadi simpan perintah kali bocor anggar habis min	negative
suruh lapor polisi salah data lapor data indihome bocor konfirmasi repot bayar mahal on time telepon tv mati	negative
suruh urus data duduk bocor bocor ya mengapai urus	negative
data bocor rahasia	negative
musim ke4 stranger things rilis juli malware incar gemar serial muncul dunia maya hatihati data bocor	negative
data bocor informasi bocor milu bocor moga tutup kebocoran2	negative
data pribadi bocor aju lupa password pin	negative
data peribadi 5 juta tumpang airasia dakwa bocor sinar	negative
kalo heran data bocor	negative
gila uu lindung data beres2 isi bensin isi data ktp dllada jamin bocor data	negative
data bocor tri resuffle	negative
aman data data pribadi bocor	negative
anggar data pribadi bocor korupsi manfaat sih eksistensi	negative
salah kaprah kait pse kominfo data bocorbenarkah daftar pse kominfo bocor data hubung kait	negative
gin lepas searching chatting shopping dsb pakai data pribadi awas privasi bocor nyawa taruh httpstco579pitlkonkuliah status akreditasi	negative
pse bocor data	negative
data takut data bocor takut broo pakai cloud storage indihome data aman hati tenang	negative
contoh bijak pse pse bertanggungjawab data bocor sisi awam sadar jaga data pribadi	negative
ah mah mending ban bocor data pribadi	negative
keri data pribadi bocor diperjualbelikan tanggung internet muncul urgensi ruu pdp	negative
data pribadi bocor takut utang online tagih tanggungjawabkalau orang 500 ribu kali 1000 ribu menang heakernya	negative
buzer tebang data ektp bocor fix nyoblos tulis akun laku pencoblosanm	negative
data bocor tuntut pakai uu ite ya	negative
kabar bocor 26 juta data browsing langgan indihome viral twitter telkom kabar hoaksakun twitter kabar data browsing history milik langgan indihome 26 juta bocor web nama bjorka	negative
hei data bocor berkalikali goblok ajar salah	negative
apakahhhhh anggar segitu jamin data rakyat bocor hmmm	negative
panggil bank jatim kait duga data nasabah bocor diperjualbelikan forum hacker bank data bocor data nasabah	negative
pakar kritik kominfo sumber data sim card bocor httpstcokzcjjuaq2i	negative
mjb psikotest hubung pintar bodoh kak sapa tau value cocok posisi diinginkanbtw kalo bimbing psikotest kayaknya nglanggar etik deh kunci psikotest bocor kayak data pribadi	negative
enggak usah jauhjauh mengomongkan ngundurin deh menteri berani muncul ngakuin salah maaf data bocor kemarin kemarin presiden bacot data is the new gold urus bocor data ulang	negative
kemenkominfo laku audit duga 13 miliar data kartu sim bocor	negative
data badan intelijen negara bocor medsos bin	negative
data bocor indonesia mah kayak dar oalah sih ya tau data sifat kayak data perban aneh ya kayak data cek banget nomor	negative
anjir nyata oknum2 bikin data bocor ya	negative
kerja menkominfo data bocor ya turu	negative
mengaco uji layak ya sistem informasi perintah mencar mencar parah kalo bocor nik data	negative
data pedulilindungi bocor diposting deep web	negative
tulcontoh ekatepe bocor cinonyata tekaa sono masuk 62 ktp 62 rejim tanggap sekaliartinya data bocor kasih cina	negative
vpn pribadi nih wkwk data bocor	negative
tunggu tanggung ya data bocor menteri menyalahkan masyarakat ganti password	negative
data bocor telepon wa kode otpnya kode tbtb uang diatm hilang mutasi tari tanggung bri menunggu hasil uang tari lumayan	negative
nyimpan duit cash makan rayap nyimpan duit bank data bocor rekening bobol aman deh nyimpan duit bentuk aset kayak emas surat harga	negative
database isu bocor bank jatim data nasabah aman	negative
facebook down muncul lapor data 15 miliar bocor jual internet	negative
jaga aman internetan httpstcocyy8rgvuba jakarta berita data bocor seruak pekan duga data bocorada faktor men	negative
naah data bocor	negative
ngeri bocor data alir dana alir solo	negative
ya contoh data warga indonesia buanyaak bocor sih sebar sih deh wajar kalo was was urung niar	negative
13 miliar data sim card duga bocor simak 3 cek aman ponsel httpstcofyynl76z89	negative
ah sih daftar aplikasi bocor data	negative
rame bocor data kominfo platform swasta data kena bocor bicara kompleks banget ya kalo cycle pemgembangan aplikasi kencang imbang penetrasi testing kencang penetrasi testing app	negative
ya bocor data pribadi kayak tau layan publik kelola amburadul tim nya isi orang orang gaptek	negative
jangan-jangan data gua bocor gegara	negative
khawatir data bocor guys bri komitmen tekan proteksi kuat hadap data nasabah infrastruktur lindung	negative
akses internet cepat internet masuk lot asia tenggara data nik bocor data bank sentral negara bi bocor ektp fotokopi situs bssn retas metaverse	negative
data pribadi bocor kerap temu sayang negara lindung warga uu kait warga bsd layang surat jokowi	neutral
data bocor pse lindung data bocor	negative
efek data registrasi ponsel bocor kah kalo iya beli data usaha kayak gin	negative
tunggu data bpjs bocor	negative
kemarin data presiden bocor ya aman mas dijadikan app bayar	negative
data bocor cuman blokir	negative
perkara email ku bocor ketar tir main asli deh data privasi enggak bisa bayangkan as an artist asa hope he is protected	negative
anjg minggu gue banget wa pinjam online atauga sumbang aaaa data gue bocor dimana ya	negative
data bocor urus	negative
kali 105 juta data duduk warga indonesia duga bocor jual forum online breached forums	negative
kominfo ngumpulin data gilir bocor menyalahkan	negative
data valid kalo junjung tuh bocor sengaja lebihin fakta sih wan got penghisap anggar	negative
pihak2 publish foto-foto deh coba data pol bocor kah data face recognition akses public penasaran	negative
orang nipu rem banget ya aman kalo main internet kayak isi gform takut data bocor menyimpan foto whatsapp bocor ngeri banget sih	negative
halah badut data bocor koar2 doang	negative
replynya ya panik takut data orang pengaruh bocor orang kayak obat indonesia cekuaks asdasd	negative
semenjak blokir kemarin kejadiankejadian data pribadi bocor dah	negative
atsi data sim card bocor temu ilegal akses	negative
aman data langgan pln aman data bocor data replikasi data transaksional aktual update	negative
linkedin mencoba data bocor wakanda benaran mencoba benaran kah	negative
hubung data bocor password	negative
beli sim card patuh atur was2 data pribadi dicuroli orang jamin kalo data bocor	negative
kontak beda nomer pakai tele invest kripto sus banget blok nomer random data bocor	negative
eh kocak pas jaman johnny goblok plate kerja bagus jabat data warga indonesia bocor ngatasin cuman ngeblok webnya kocak anjg	negative
laku data bocor ganti password email	negative
mahfud md klaim data bocor hacker bjorka tunggu	negative
buka peluang lo bentuk uang tugas layan lo nyaman langgan oh iya lupa data lo bocor	neutral
sok banget deh nama lingkup privat data bocor mulu wkwkwkwk kominfo nih lihat urgensi	negative
capek mengomentari salah tri konoha sibuk game gaple mengurusi data bocor wadudu	negative
percaya tempo mentahmentah moga lekas sembuh deh data bocor mikir seringkali bocor sengaja dunia hitam putih tempo whatsapp langgan malas miskin	negative
need jada kecilin size file data bocor inrush	negative
tingkat bin data bocor	negative
feeling gue data pribadi pedulilindungi bocor jyakh	negative
untung sih ibuk mengasih tau wkkw bocor data orang urus hunter host polisi hayoooo bilang terima kasih sih edukasi hunger paham	negative
