sok sok mengomongkan metaverse data aman negara dibenerin data bocor tindak diam doang	negative
gila data gin bocor rem sih	negative
data sim card bocor suruh rakyat jaga nik salah mengapai suruh suruh registrasi sim card pakai nik gue tuju putus why timbul bocor data sim card salahkan rakyat	negative
mjb ganti pas email nya akses aplikasi bocor data nya kah bocor tokpedwattpad login pakai email cek pas email ganti	negative
nya data browsing history data pribadi langgan hilang cokkk kayak data vaksin bocor	negative
mengaku yayasanyayasan mbak menawari nitip doa sumbang wkwkw data bocor aneh kali nyapanya pakai bunda nama lengkap	negative
aman data diperbaikin rawan rawan nya pinjol penyalahgunaan data kadang data bocor ngebuat masyarakat susah percaya apps moga kualitas rambah super app	negative
silit lo mengomong metaverse data orang bocor urus jembut	negative
dungu data 13 b bocor gin	negative
data bocor ya pakai internet lembaga gaji pajak masak hahahihi doang lucu	negative
data aman kayak ginimudah bocor mentang2 orang desa mengerti cyber scurity kayak gin	negative
netizen jago kayak detektif maya keren banget data laku bocor mantap	negative
pls kemarin ngisi bensin kayak apaapa mahal data bocor kriminal manamana sedih apas hhh	negative
ah lo mah mending gue data gue bocor	negative
data bocor hacker bjorka fakta	negative
telkom hasil investigasi duga data indihome bocor	negative
mikir salam concern banget politik indonesia data bocor real asli	negative
marahkrn data rakyat bocor	negative
install butuh krl awal-awal ragu takut data nya bocor dll heran gin negara aing deh ckckckck	negative
data bocor langsung spam tipu whatsapp benerbener deh kominpo	negative
data bocor kabeh sok-sok an ktp digital pretttttttt	negative
kena data badan siber sandi negara bocor deep web httpstcoanw6hfa0r5	negative
bocor data indonesia bocor data pribadi sektor swasta lembaga negara alhasil datadata bocor diperjualbelikan dunia maya	negative
gue nih banget datadata pribadi situs indonesia orang indonesia bocor orangorang iq jongkok tukeran sosmed ayangnya poor password security ckckck	negative
seuatu data bocor djp laku coba jelasin sopnyajangan bilang jaminsaat nikah suami istri janji seengga2nya harta 2	negative
ya ya kelas profesor wadaw sikan but respect sik iso ngetuti kembang zaman bedo karo dosen seng nde kene prof hormat data data e indonesia bpjs ektp vaksin wing jebol lo iki dicollect nde pse bukane ngko bocor kbh	negative
server milik universitas brawijaya malang duga serang retas akibat data alumni universitas brawijaya 2020 bocor retas milik data alumni nomor induk nomor telepon alumni httpstcons6oyeqsse	negative
retas hacker bjorka data mahfud md cak imin bocor publik	negative
bank jatim duga data bocor data nasabah aman	negative
data pribadi warga pilih indonesia duga bocor forum retas online akun retas jual 13 miliar data registrasi simcard milik kominfo bjorka kali tawar 105 juta data pribadi masyarakat indonesia httpstco6wim5vjwpa	negative
min semenjak ganti kartu hc exlegacy bsi usaha bank chat telpon email jasa perban data bocor	negative
kalo nama muncul data bocor gue percaya kalo hackernya benerbener jago	negative
nilai egois pilih bilang peduli peduli data pribadi sebar peduli sekian juta data pribadi orang kemarin bocor i dont think sok	negative
gilir data kau bocor ribut pas data rakyat bocor suruh aman ngadi2	negative
data pimpin negara bocor hackerdi tanda tahan indonesia lemahpara buzerp suara nyaapa kah	negative
sungguh lucu kakak pakai daftar nomor sim card pakai buzzer fake accountlantas sih buzzer pakai nama comot foto profil kitaketika kirim langgar hukum cari berwajibdata bocor	negative
betullll data masyarakat bocor ria paket pager rumah	positive
data 500 juta facebook bocor meta denda rp 43 t	negative
data bocor data nasabah aman	negative
baca juta data bocor uu pdp solusitcocrudlbcmay	negative
kayak dunia nyata ya data bocor data warga	negative
mengapai sih lolot dana ovo gopay dkk app plat merah bikin data gampang bocor	negative
data pakai cat no drop bocor	negative
tenang ges bocor data jangan-jangan taktik jenius perintah wakanda data bocor lama-lama data harga deh orang tarik curi data sih brilian	negative
solusi data bocor indihome pln	negative
he nalah bocor data heh	negative
data internal china bocor 250 juta covid19 catat desember 2022 fakta	negative
data bocor bbm lengkap banget ngentot	negative
data warga bocor gayagayaan mobil terbang	negative
efisiensi lupa utama aman ya bu berkalikali data pribadi rakyat indonesia bocor diperjualbelikan moga ruu lindung data pribadi sah	negative
pln klarifikasi duga 17 juta data langgan bocor replikasi	negative
bi data 70 an hutang ri produktif sisa non profit alias dana sosial kemanusiaanbijimane lari uang bocor rugi puluh triliun mrjaya ancol data bocoritu parah hutang non produktif	negative
data pilih goreng data hasil milu 2024mengesankan kpu rekayasa milu 2024 rena hasil bocorini goreng bahaya sih	negative
semenjak bocor data bsi kali masuk chat akun scamming wa	negative
jamin dok jujur keri orang data masyarakat bocor obat racun beda dosis	negative
hello data browaing history nik langgan lu bocor anjrittt	negative
buzzer efektif gue mengikuti seru sih lama-lama kayak drama skeptis wkwkwk kalo data bocor yaudah diharepin tri sih diharepin gov	negative
pakai sopi khawatir data bocor	negative
sok sok 40 data bocor mulu cokkkkk	negative
bssn khawatir kolam renang rembes data wni bocor	negative
data 17 juta langgan duga bocor pln laku investigasi	negative
data gue langgan bocor	negative
filmfilm full action rebut data agen negara arti sebar leluasabtw namanama tim sampeyan lok bocor teh	negative
ppkm cabut mesti paket pl malas banget aseli pakai apps kalo data warga bocor	negative
data bocor internet resiko internet bijak salah bocor data pribadi sendiriyuk simak tips jaga aman data aplikasiinternet	negative
keluarga teman dll selsai jam kerja lu gedung kantor lu lu ngerjain return data kantor aman bocor	negative
iya data data agens bocor	negative
mjb kak tau data bocor ya	negative
ya data indons aman nomor hape pribadi gampang banget bocor nya	negative
bocor data jahat siber cerdas aman lemah data bocor internet cont	negative
data bocor solusi ganti password	negative
jhony stop main game uler tetris tanggung kalo data presiden bocor lho	negative
data pribadi bocor dipakai telemarketer indak masya marketer zoom kenal produk bayar 100 ribu isiin gopay nomor bocor ya gratisperusahaannya bonafid uang anggar marketing duit	negative
data ku bocor cuk	negative
data sim card bocor media main blender menkominfo johnny plate dibuli warganet	negative
rugi sidang nutupi data bocor orang-orang siapajadi tuh benar-benar losing game 2 orang korban negosiasi bocor tuh	negative
data nasabah bocor pemberitahuan bahas bsi	negative
sih bjorka spell data bocor kaleng2anies baswedan kena spellkira2 rame nih gue coba cek nyata anies booster kayak nya nyuruh booster kagak vaksinpayah	negative
kapasitas ram penuh banget malware batrai nya bocor dikit ku cek nya youtube ng bongkar alatalat nya 2 pakai batre kndas pakai zoom menyimpan data	negative
boomer mah tau nya genteng bocor doang kalo data bocor data dimana	negative
nyetak kartu vaksin data lu bocor	negative
bikin akun al0doc besok pagi nya data bocor langsung telepon tipu tau join al0doc data ktp syarat hadiah	negative
data bocor panik nyalah menyalahkan	negative
data baca mah bocor aman baca	negative
26 juta data langgan indihome duga bocor telkom respons	positive
lindung data kayak lindung tau kemarin data pilih kpu bocor jual forum hacker data duga akses bebas sih hacker cuman tinggal ngambil doang negara tinggal	negative
data nih encrypted orang bocor key	negative
calon bocor data orang kemanamana	negative
fotokopi ktp kakak bungkus goreng alias data bocor terima kasih sender	negative
24 jam 2 wa tipu data nih bocor	negative
halah deh mengurus data bocor sik gena	negative
bjorka manfaat data pedulilindungi bocor milik nyebar data orang-orang kait kalo benaran data lidi dll data personal such as nik kakak alamat dll	negative
mending urus noh aman data pribadi bocor mengurusi	negative
lucu menteri coba cek bocor data nik nya cari solusi menkominfo wajib daftar pakai nik ngeles buruk	negative
data publik mrmperlihatkan nomor telp 3 4 angka ganti tanda kali rame-rame kuis buka informasi angka nomor telp ngamuk data bocor	negative
pln data langgan indihome bocor sih bocor melulu	negative
halaaaaah esim esim data privacy warga noh bocor kayak genteng rumah rt	negative
indak pakai vpn data bpjs bocor	negative
data vaksin bocor ya	negative
data bocor perintah giat tangkap laku sistem aman data fokus netizen giring sosok laku akar biang perintah gagal jamin aman data	negative
pakk tau gara-gara bocor data salh banya sms wa sampah iklan silih ganti	negative
data sim card bocor	negative
sumpah ngeri banget data nasabah baca bocor tipu	negative
mengobrol big data negara rakyat nya fotokopi ktp kakak data bocor usut tuntas blokir situs	negative
login 6 kali loh uninstall 2 kali kasih otp sesuai blokir 44 menit akun otp bayar sih tolong tindak nih kredivo kalo bocor data	negative
aneh banget sih data bocor sih	negative
data is the new oil ya jenis bbm bocor obrol unfaedah maksi	negative
baca psenya pengaruh bang pasar indonesia pse nya ku steam pajak kait data user keminfo protect data tuh bocor	negative
enggak usah bang indonesia butuh kuat kualitas aman cyber kalo data bocor tinggal ngerepotin rakyat salahkan rakyat	negative
meanwhile pusat riset pakai teknologi cina muraaah accuracy rendah data bocor shaaay duit cekak	negative
jenis data lamar kerja pertamina duga bocor forum hacker	negative
data karyawan the guardian bocor rincian gaji ekspos httpstcoppo1vphaib	negative
blokir situs mending urus data bocor indonesia data situs perintah bocor	negative
ub koordinasi bssn kait data mahasiswa alum sebar kait retas duga sebar data alumni mahasiswa s1 universitas brawijaya ub 2020	negative
mending lu bubar ajakerja becus data bocor mulu ngebokep	negative
bbm data pribadi bocor era buzzerrp rawan seru 3 periode data bocor sanksi kumpul data pribadi 5 bocor 3 periode ndasmu	negative
data badan intelijen negara bocor tanggap juru bicara bin	negative
1 data bikin tim khusus 2 tim tim tim utama 3 kerjasama daftarin pakai identitas bocor 4 hahahaha bilang menambah anggarankenapa panik kalo deh efisiensi	negative
ez data indihomo bocor data model device target orang lihat devicenya target utama data nomor hape imel nya rawat jarang gonta ganti	negative
zaman merah data bocor ya	negative
heboh data intel bocor jubir bin hoaks	negative
marak data bocor pesan stop being naiveterhadap serang siber leading sector domain tugas pokok fungsi	negative
tukang gaduh data nya bocor aduh2 katauan	negative
hahaaabjorka mempan data bocor korban akun mati	negative
gapapa sih tinggal indonesia data bocor gais	negative
deh data customer lo bocor gin tipu	negative
asik banget data rahasia bocor wkwk kayak film orang drama genre crime lol	negative
pagi marah-marah yaudah ngetuwit nih nipu2 retas data ohya data bocor perintah negara abai hadewwwww suka rela ngisi data apk peduli lindung bank linkaja jmo jkn owalahhh	negative
mantan kaba sanksi institusi kumpul data bocor	negative
pakar aman digital duga 15 juta data password bsi bris bocor layan eror akibat ransomware	negative
gue tuju postingan urus slebew jurus porno mending menkominfo urus tuh data bocor kali doang kalo kominfo sapa cuy	negative
nelpon nomer gue ya mengaku teman gua nomer pakai orang enggak ada tau data gue bocor ya anjeng	negative
susah data telkomsel bocor cleaning service kayak tuh rame	negative
miliar data tiktok kabar bocor nilai bahaya utama selebgram	negative
data bocor heran sih ngechat tuh berani banget whatsapp	negative
cepat digitalisasi tanda bikin aplikasi paham hasil data pribadi bocor simple bikin aplikasi harga aplikasi akam variatif harga parameter	negative
kartu data bocor aktif november 2022 edar data pasar gelap coba laku transaksi kartu arti denda 5000	negative
pakai pln mobile nice pas data bocor	neutral
ya data bocor habis suruh fotokopi	negative
juta data sim card indonesia bocor	negative
kecewa data akun bocor laku beli kurir kirim paket cod seller tau detail kontak alamat milik akun laku beli seller	negative
lihat file datadatanya bocor komputer kantor pajak sifat cakup data luas kantor pusat wilayah tempo jumat 3 maret 2023	negative
sms tipu data hp orang bindo bocor	negative
sih awas data masyarakat noh bocor kagak lu awas aman	negative
goblok gapapa data bocor gapapa mengomong kasar iman tuhan maha esa	negative
negara data lembaga usaha bocor mengaku mengaku heran deh website bssn dideface halaman public relation	negative
bodoh banget nya nglakuin 2016 views nya 10 orang komentar 2 orangyg asli forum jm anti nohh 1k album nya sabotase jm data peibadi nya bocor perushaan nyuri dokumen cicil bayar aparteman jimin stan fitnah sabotae	negative
semenjak issue data bocor akbir suka sms wa undi hadiah kocak wa nya malam gin	negative
hera tri kerja nya mengapai sin data warga bocor kerja mengapai nyuruh warga jaga data nya heran aing	negative
plate mengaku data kominfo bocor suruh jaga nik paksa daftar pakai nik dibocorin mencari kambing item bbm demo sambo putri komnasham	negative
data msib bocor kah takut	negative
nasib juta data bocor atuh pakini mah kaya komik detective conan bjorka kaito kid susah lacak ditangkapsia2 hambur uang negara ngebentuk tim kayak	negative
menteri lu bocor data pribadi kayak menteri guel	negative
13 miliar data daftar kartu sim indonesia bocor kominfo okezone techno	negative
kakak kirim penasaran kemarin lihat tweet orang beli data nama chat toped kayak data toped bocor tweet kalo ponakan tinggal	negative
data apps myubat bocor sistem komputer	negative
marah nih ya sabar cek data ya bocor	negative
mendengarkan ya gaes data bocor loh eh	negative
yuk rapat baca sob mengupdate berita n analisa nya editorial bocor data lindung negarakok ya islam tanggap paham agama bangga islam khaffah	positive
data mulu bolakbalik terang kondisi anak terang bantu kagak resiko bocor iya rapat ngumpuul	negative
data 15 miliar facebook kabar bocor jual internet	negative
36 juta data kendara bocor potensi diperjualbelikan internet httpstcoiqnzx2oyvu	negative
idol susah nder mending bebas diikutin bebas data pribadi bocor	negative
the way lu fucked up by ur country 1 data pribadi bocor dimana2 kominfo bilang salah masyarakat wkwkw 2 never ending story sambo pc roman2nya tsk bebas 3 bbm kayak tahi laki gue ribet kantor anjing 4 bahan pokok mahal woy	negative
efek data bocor oknum mas	negative
rame data bocor ya ya kaget bocor indonesia govt need hire security experts the get things done time	negative
data pribadi bocor kayak kejut	negative
duga 26 juta data langgan indihome bocor kominfo ambil langkah	negative
gembar gembor lindung data pribadi eh gilir masuk tamu kompleks gedung kantor ktp suruh tinggal data pribadi bocor tanggung ngehe	negative
komunikatif kalo tarif promo rayu gombal hapus eh data langgan bocor yoook masuk instansi tahap testtesttest bisaaaa data langgan bocor	negative
gue kenal abby wei fix nomer gue masuk data bocor kemarin	negative
set deh pas data bocor tereak2 wkwkw aneh sewa hotel bandung ken gua coba bagus hut verifikasi suruh ngumpulin poto poto ktp aneh	negative
ektp suruh fotokopi data duduk kadang suka bocor proyek metaverse fokus aneh	negative
data bocorkoneksi sampah wow usaha dukung industri 40	negative
ngalihin isu data data jabat negara bocor instansi kelas bin bocor	negative
lu mending mengurusi data bocor	negative
mending jual data langsung duitin duluan colong data bocor	negative
ngomong2 data aman vaksin data2 pfizer bocor ptun	negative
data pribadi bocor kumpul	negative
iya kena doxing laku langsung ditangkep beda cerita ulin yusron doxing dilaporin eh ulin yusron komisaris data bpjs bocor dilaporin bebas bebas tuh oknum bpjs nya	negative
website daftar pse arti tunduk bijak indonesia arti sistem aman website sangkut pegang kominfo data website bocor salah kominfo konsep	negative
ngelucuuuuu lu bapakkk gilir paypal daftar lu ancem2 isi polis paypal rela mengasih data nya lu lu kgk tanggung kalo data bocor	negative
hai joki pinjol banget ya khawatir data bocor trik rahasia penasarann yuk langsung dm yaapp	positive
ya pecat oknum model gin ya 1 2 mengerti data bocor	negative
akibat data duduk bocor	negative
102 juta data masyarakat indonesia duga menteri sosial kemensos bocor akun twitternya platform investigasi retas dark tracer abar bocor data kemensos httpstcohlaxhjwfrj	negative
data apasih bocorkesebar negara wakanda	negative
alas aman informasi user anjer mah wajib developer kali jagaanjing banget sumpah data bocor tanggung seengganya bantu diam otw komunis ver beta anjir mah	negative
urus data lho nama keluarga personil bocor 2020	negative
ganti data pribadi bjorka bocor wajah perang hacker nih jepang ning imaz anteraja ngaku2 nu effensi simbolon cirebon leceh	negative
bocor kacau kartu sim lekat data pribadi otp kirim by sms no hape niknamatgl lahir enak banget brute force password ayo pakai password pakai namatanggal lahir4 digit no hp lekas ganti	neutral
kominfo lu gilir data pribadi bocor diam anying	negative
telkomsel pln data bocor rupa data palsu sengaja sebar asli	negative
akeh data bocor	negative
kalo ln data bocor spam kayak tuntut indonesia ladang bisnis	negative
halo sayabdi teror mulu marketing nama danamon buka tabung tandatangani data anak usahaaffiliator danamon data bocor	negative
huhu sih kak giur joki pinjol back up data dll tau pret joki pinjol trusted ngambilnya legal back up data trusted tau bocor tuh data	negative
nih perintah menunggu korban viral bertindakkek gin bahaya rahasia data bocor pinjop	negative
data info bocor wikileaks ya ngaruh2 sih bocor situs perintah	negative
bikin atur spa data bocor menkominfoga faham kelola	negative
kominfo bantah 13 miliar data kartu sim bocor mira format data klaim bocor situs forum retas httpstcoqhw9a2vqxi ala kominfo	negative
data presiden bocor ubah paspampers ya gercep kayak	negative
lo bikin data bocor anjggg hoblokkk siaaaa	negative
akibat menyimpan data pakai kantong plastik gampang bocor	negative
lu bahagia ya data denny bocor lu memikirkan teman lu kadrun ditangkep polisi wkwkwk entar hekel internesyenel idam kadrun ketangkep	positive
riskan kelola aman data pribadi aplikasi ojoltaxi onlinelogical error contoh real ehac bocor prtanggungjawbn menkesnya suruh uninstallkelola data pribadi kesan cobacoba	negative
takut data bocor phishing yukz simak tipsnya	negative
gampang sih data masyarakat bocor ktp bpjs dll percaya undangundang rubah rubah ekspose publik sembunyi	negative
perintah kemarin data bocor benerin ngeles kiri kanan nantanginpemerintah republik kalo salah colong mengaku ngeles doang jago sok just shut the fuck up	negative
data ktp suka bocor	negative
tau data bocor firewallnya kagak sanggup yaudah offline rombak system sederhana kayak gin data bocor online kagak rombak indonesia pegang servernya kagak	negative
kalo telponsms auto blokir pakai true caller berani wa heran darimana oknum2 iya data seluler bocor	negative
data bocor pakai alat canggih salah tangkap negara lomba2 jelajah bulanmars bangsa atas2 nya cerdas	negative
data negara bocor kutip lengkap kalimat prof mahfud lansir inews bocor data hehehe data negara lapor bssn analisis deputi kerja	negative
warganet peduli cari nafkah ketimbang ngributin data data bocor dijualin ketigabnyk banget freelancers hidup benar-benar gantung paypal mrk2 suruh mampus gitumain blokir2 solusi kntl	negative
ketua komisi i dpr tindak data pln bocor	negative
2 12 kali data bocor hacker internasional hackernya jago tahan	negative
jual bodong beli laku nyangkut duit lagak transaksi pakai kripto apa-apa fotokopi data publik bocor pakai debit alfaindo kadang errormending investasi tuyul	negative
lepas laku umumtapi budaya video orang nyebar medsos meresahkanpantes kominfo data bocor warga hobby banget langgar privasi orang	negative
komplen berbusah2 kali gakan jalan indihome wkwkwk yaudah ikhlas data bocor ulah oknum kalo indihome jamin aman	negative
data deh bocor apps covid scammer judi online scammer jnt barang pickup scammer barang order kena tax aia insurance claims bodoh jer	negative
yessss uakeh ngene iki iso data bocor coba	negative
rem data bocor kayak khayal data genomik bocor ngeri dikirimin sakit doang bida sakit	negative
mohon mahfud md bocor data ktp sim card email bahaya tanganin serius mr bjorka orang fake mr bjorka hyker indonesia bocil bocil manfaatin data privasi pinjol traskasi uang putar pakai mobil banking bocor	negative
apaapa daftar online kena hacker data pribadi bocor privasi plussnya dunia technology kembang	negative
bjorka bocor lagih data perintah oli garki	negative
hah rem banget bocor data nomor hp lu cup	negative
kayak nya gelitik gue deh mbak bjork data mirip2 data pedulilindungi bocor vaksin orang lu spil hehe mbak bjork ambil data sono ye hayoooo lu mbak bjork mengaku	negative
bikin pse ngamanin data bocor sabotase ya aneh kalo steam keamananya bagus ogah daftar lu	negative
data toyota bocor 296 ribu informasi langgan ancam sebar httpstcokfgzhznych	negative
gin kalo hacker aman periksa tolong aman periksa bpjs bri tokopedia bin bocor data jaga data	negative
gilir data elite bocor panik pas kemarin data rakyat bocor suruh jaga masingmasing rakyat lindung haha	negative
negara tuh fokus tegur lembaga organisasi usaha kumpul data masyarakat big data data bocorjangan fokus kejar hacker hantu blau rimba	negative
steam bayar pajak loh daftar pse langsung blokir sajautamakan urus aman data pribadi duduk bocor bukti aman data negara lemah	negative
privacy warga negara bom aman sok usaha daftar pse biar aman apa-apa steam enggak mau daftar privacy no1 lindung konsumenpengguna bpjs data bocor lain2 nik no kakak daftar kartu konter2 tau lawak	negative
data gue bocor bsi tebus lockbit gue pakai bsi	negative
data bocor data nasi bungkus	negative
data duga bocor nomor telepon nik kemenkominfo investigasi dukcapil operator telepon	negative
nih data bos kerja bocor	negative
komputer riba tumpu siasat data 46 juta nombor telefon bocor 2017	negative
data bocor jenderal bunuh bbm rusa lingkung oligarki yawooh	negative
paleng parah bocor data warga negara indonesia peduli lindungimslh nya mengupdate medsos sangkut	negative
ya ya ngeblock cari ganti banding lahkalau ganti cobamending mengurusi nomor kenal menawari pinjam data rakyat bocor	negative
mengertibahwa data file perangkat jamin aman bocorbayangkan data bocorapa kitasiapa rugi inidan dampak	negative
husnudzon kang hindar data leaking platform digital ngaruh bocor	negative
rampung 13 miliar data daftar kartu sim bocor muncul duga bocor data pegawai negeri sipil pns data sifat pribadi	negative
makan pegawai biyuemen daftar bocor data	negative
tinggal indonesia skip bos jaga data kalo ujug2 nya bocor negara	negative
mjb kak tipu telpon mengaku shopee dana data bocor orang dihubungin modus kalo kayak tau tulis paket kak nama nomor ya sih	negative
budak kode referal data appnya bocor mampus dah pakai foto ktp	negative
mari diskus kena aman data data bocor tech talks 15 pembicarahari rabu 20 april 2022 131430 wib bicara dedy hariyadivp tech at widya security lecturer at jenderal ahmad yani university	negative
dagang mulu menanggapi data artis bocor 3 hate komen sasaeng coway se0kjin tehavi rumors militer colong kayak banget respon lu gue lihat-lihat gila gila nya ya gue lihat nih orang lama-lama	negative
bocor data open source	negative
boomer2 kemenkominfo kayak tau data kalo bocor arti enggak ada kayak barang kalo maling hilang tenang ya barang mata sangkal remeh	negative
data bocor lintas negara	negative
hati-hati data bocor jenius tf tbtb2 tagih kreditpintar kalo enggak salah	negative
harga pangan fuck you perintah data pribadi bocor yashhh thank you bjorka you such a king yesss go bjorka go	neutral
httpstcodxu03puenrkominfo hatihati hacker incar sistem ecommerce pemerintahansetidaknya 47 jahat siber upa retas data bocor indonesia 2019	negative
baca baca info nyata data nomor telkomsel bocor pantesan spam sms masuk kemarin teror pinjol usaha bumn hadeh	negative
omg data jabat biar sadar wkwkwkwk data rakyat mulu bocor merasai wkwkwkwk	negative
eh data pribadi rakyat bocor mana2	negative
slebew blokir gilir data rakyat bocor tanggung	negative
ribut data bocor korban kemarin2 arti seminar big data 40 bahas sekuriti data fafifu wasweswos belaka	negative
bujug gue off bentar data presiden bocor	negative
preeett jlas2 dbongkar e aplikasi kuntul nyebar plindungi bocor bocor data	negative
data bocor mendagri mitra kerjasama dukcapil kuat aman siber	negative
lembaga negara alhasil datadata bocor diperjualbelikan dunia maya bocor data akibat atur atur kait lindung data sadur	negative
aplikasi data ptibadi entar kalo bocor tanggungjawab buang duit bikin aplikasi	negative
awkaowka data bocor atuh	negative
ya kemarin data indihomekemenhukansama lupa bocor bang	negative
kalo data no hp bocor operator bocor operator kalo data bocor nomor hp nya operator arti data bocor mengcompile data operator	negative
menkominfo password ganti data bocor pakar httpstcotdzrtp4zgb	negative
antum kalo ngeles pas data bocor	negative
bocor data jabat bakar jenggot kali batal registrasi ktp kakak	negative
musim hujan gin atap rumah bocor ya kayak data duduk negeri tercintahhh	negative
data negara gampang bocor anggap jabat negara	negative
hubungan data bocor kemarin ya	negative
data bocor kudu diperbaikin menambah fitur payment biar user percaya aplikasi	negative
ri mengurusi kayak gin ya data bocor	negative
httpstcoi4fp9ntsul28000 data polri bocor analisis kompas com 19112021 1745 wibpernah jejak	negative
kemenkominfo catat 47 jahat siber upa retas data bocor indonesia 2019 sektor ecommerce instansi perintah sasar	negative
hoho nyata government sites data bocor sites nya users device sih ya ekspos kredensial	negative
cek bocor data	negative
