ektp fotokopi data jebol jual no telp gampang jebol jual bebas data vaksin buruk data aparat abdi polri jajar data agen intel bocor kominfo just silent	negative
data duduk gampang bocor enggak usah dihack karyawannya tolol enggak punya logika manusiawi budaya baca ketik pamer hasil pikir otak khalayak	negative
anak bangsa anak bangsa data bpjs 279 juta warga bocor lu urus sat	negative
bocor data ktp jual belikan	negative
awasin tuh data pribadi bocor	negative
alhasil dirga beredel lapor ordner banding lapor milik marketing casual leasing pinjam hati takut data usaha bocor	negative
safenet 13 miliar data sim card duga bocor asia httpstcob7yf9klcwj httpstcob7yf9klcwj httpstcot9nx5gs0y6	negative
kominfo lihat something pron heh gaboleh blokiralso kominfo lihat data rakyat indonesia bocor	negative
saking data bocor ya pasrah	negative
wes lamax2 data ibux2 posyandu bocor	negative
salah orang senggop data bocor	negative
email gin rahasia ya seengganya sensor kayak gin orang-orang bocorin data ngeluh data duduk bocor hhhh	negative
usaha swasta situ situs resmi milik perintah bocor contoh data pedulilindungi bpjs bri life aman kelas negara retas laku	negative
teman gue langsung cek nomernya nyata tipu gue kasih data bocor	negative
datadata jabat bocor kali ya cek slik idscore nya ken lihat riwayat hutang	negative
oh menunggu serang bocor data diema data pntng sistem goyang sayang	negative
heboh duga data indihome bocor	negative
data bocor kominfo pt pln httpstco493fouej0p	negative
kemenkumham bantah 2000 ribu data pegawai bocor	negative
kalo cilik antri sembako bbm diam menbeng peduli data bocor kucir blt bbm sembako kalo pns cukupberpangku tangan pit terima suami yqng banget dosa ya makan nikmat amin yra	positive
data perintah bocor get contactnya langsung penuh kali ya	neutral
woi bocor data ulang bertanggungjawab	negative
data langgan duga bocor httpstco75aukafy1q	negative
kerja klean amburadul data 13 miliar nomor hp indonesia duga bocor nik nama operator	negative
data daftar ahu kayak bocor kemanamana 3x tawar urus badan minggu	negative
data bocor jual duga isi identitas pribadi warga aju adu kpai nama lengkap nomor telepon alamat domisili	negative
awasin ojk data bocor jual belikan kayak gin domain murah gin wkwk registrasi pakai foto ktp nih wkkw	negative
sial tipe orang gaenakan korban 1 lurah data ktp bocor semuaa	negative
data retaskebocoran data indihome duga rupa pt plnpersero 17 juta langgan pln duga data bocor simak lengkap serbaserbi mmc	negative
15 juta data nasabah bsi bocor menteri bumn tanggung	negative
data pribadi masyakarat simpan bocor jual red forumyaudah blokir slebew	negative
data bocor kemanamana	negative
tugas bikin super nama bocor data bikin ide mending kembang	negative
kpai data nasabah bank jatim duga bocor diperjualbelikan forum hacker database tawar harga usd 250 ribu rp 35 miliar	negative
denial bilang data bocor data alias data spesifik bikin timsus pecat joni becus kerja kuat transaksi politik nasdem partai kuasa dipertahanin sih joni	negative
data cakap bocor biar masyarakat hakim	negative
no 1 pokok nya kerjain data masyarakat bocor urus sekian	negative
data pribadi bocor johnny plate masyarakat ganti password	negative
rame data simcard bocorselain data simcard bocor bocor sahabat pilaryuk request lagu musisi indonesia favorit bareng om raka stayjamz live streaming	negative
serius cari arti negara bocor data bocor negara anteng	negative
data 21 ribu usaha duga bocor pakar forensik digital	negative
men judge sih jaga data warga indonesia bocor ngelacak lokasi ragu	negative
asli sih bocor dukung kecuali manipulatif data suap tipu muslihat rakyat	negative
concern data ya registrasi loh ya data ktp bocor sih inovasi tinggal scan apps kai bagus banget fr skip deh	negative
perintah wajib menvalidasi data bocor bur mitigasi celah biar lagigregetan banget ai lihat reaksi perintah	negative
ya dibuatin uu sih pegang data kalo bocor kena tuntuan hukum biar mikir memegang data	negative
pakai nama kalo data bocor tau nama keluarga preventif sih	negative
aga tenang langkah laku 1 saldo range jamin lps 2m suku bunga 425 tabung rp 225 valas 2 ganti password produk perban antisipasi data bocor	positive
level menteri bicara data simcard bocor masy suruh ganti password simcard passwordnya pin simcard kait data kirim providerkemenkominfo bocor server pegang data simcard	negative
dasar incompetent ya heran data bocor bilang enggak ada bocor suruh tenang banget data retas bodo kali sistem elektronik hes charge memanage cyber security negara	negative
tolong ya mudah data wajib pajak bocor pegawai	negative
privasi data bocor nya sambung telepon no bal nama konfirmasi keluarga bal bayar no blokir bayar on time lapor ya by cs telepon	negative
data pasien corona ri duga bocor respons menteri plate	negative
ngaruh data pribadi bocor databse bpjs	negative
httpstcoctghpoevibempat puluh juta catat tumpang malindo air bocor kena hack data curi 2019 unggah online	negative
laku data pribadi bocor sobat siber rupa pandu laku data pribadi alami kebocoransilakan simak ya sumber ccicpolri	negative
breakingdata bocor roman abramovich diamdiam laku biaya langsung klub berkas kisar 117m roman vitesse	negative
perintah ngawur attitudenya kait cybersecuritycontoh tokopedia gagal jaga data orang hukum matisetiap input data pribadi asumsi bocor	negative
miliar data whatsapp global duga bocor jual ilegal tips kaspersky lindung data platform	positive
gue benaran shock banget pas lihat nama kalo teman gue nyaut halo halo gue mikirnya jenis phishing data gue bocor sadar gue nelfon duluan	positive
gembar gembor data bocor kalo mengurus apa-apa pakai calo kakak ktp no rekening serah cumacuma calo calo manusia daftar pinjol hehe	negative
data nasabah bocor	negative
menonton kompastv data sim card bocorpk mentr1 wifi rumah ganti mudah bobollaaah acara stand up sore ya	positive
prestasi intasi anjing sensor film kartun bijak kelola kerja mending bubarin anjg parpol anjg	negative
hmmm maaf nih tip ciber pp kerja manfaat ya bantuin perintah biar data duduk bocor lo hina didatangi atut	negative
iya sebegitunya ngetop sih ds banding wan batavia data bocor data wan batavia rame korban heker revolusi tuh kadrun payaahh hekernya	negative
pakai nama efel transaksi transaksi kerja pakai efeljadi kalo spam text manggil pakai nama ya bukti data bocor sih wkwkwkwkwk	positive
benaran bocor arti orang data bong bocor	negative
gilir data bocor lempar tanggung	negative
slogan perintah kerja kerja kerja tiup bjorka kerja mengapai deh laba data tri bocor ketahuankan booster rakyat tumbal coba vaksin gilir	positive
register data entar bocor publik	negative
data bocor	negative
kayak data bocor hacker jual under web kak	negative
urus cs kudu scan ktp i dont feel comfortable data bocor pakai kertas nomor nyaman	negative
erick thohir marah data pribadi bocor beliau dokumen rahasia jaga daulat digital ri	negative
pakar aman siber kasih pandang data bocor darimana kalo kominfo bilang data kominfo selamaini pegang data no hpnik operator seluler sang pakar jelasin	negative
satgas sertifikat vaksin jokowi bocor nik sedia data pilpres httpstcokgcuy7bik6yg orang tau nik orang mudah akses verifikasi otp sih milik nik daftar	negative
pffftttt urus noh data bocor	negative
data kominfo 13 milyar data kartu sim ponsel bocor forum blackmarket	negative
kominfo nya sibuk mengurusi pse platform blokir enggak mau daftar platform pse aman data data bocor platform milik negara come on	negative
maksud mas nya worthless data orang indonesia bocor cth bpjs kemarin dll data ya kemarin2 bocor	negative
zaman serba digital inidata pribadi milik kali bocoroleh karenanyaperlu atur aman bijak jejak digital	neutral
johnny plate ganti nomor amerika data pribadi bocor serang siberkoplakpresiden jokowi lebay begitubeginilah kalo pilih orang partai mengerti bidangnyaanggaran 26 triliun kominfo bangun sekuriti kuat aman	negative
nama ana foto nya laki nomor data gue bocor wa gue masuk spam fraud	negative
tuju kalo data usaha bocor human errora thread	negative
pasal 21 ayat 1 ampas data peduli lindung bocor	negative
menteri pilih hadap pers masyarakat hebat bangga stay kominfo bocor data 100 juta data bocor jual	negative
who got data nik bocor	negative
broo buset netizen indonesia gila gila 24 jam bocor identitas pribadi alamat lengkap sih agnes sekolah data pribadi orang tuanya netizen asli kayak fbi informasi senjata bahaya	negative
bssn buka suara kait data bocor ri	negative
anjir main slot data gue bocor deh memasuki data sembarang kena	negative
data bocor instansi instansi kena as long as you dont get any financial loss dilaporin	negative
serius data lu bocor	negative
bingung min coba deh bingungin data mudah banget bocor dihack	negative
percaya data bocortapi nyata hoaxs	positive
dear komentar berita initwitter retas ratus juta data duga bocor	negative
selagi bocor data jabat ya	negative
httpstcoli6qj43qwz stop being an idiot data bocor tugas kominfomenkominfo merespon pesan sudut menteri pimpin	negative
bayangkan data video game doang bocor ngincar fbi indonesia data bocor suruh ganti password cuy	negative
ciri khas rakyat wakanda panik data bocor kakak bungkus goreng panik data bocor dibocorin heker	negative
registrasi nik kakak pas data nya bocor lepas tangan super	negative
sebar nik presiden joko widodo sertifikat vaksin bocor sebar media sosialserta keluh kait aplikasi pedulilindungimendorong pimpin dpr bahas rancang undangundang lindung data pribadi selesai	negative
data pribadi orang indonesia murah saking gampang bocor wkwk jual murah harga gampang banget jebolbe smart kominfo protect your country protect your people	positive
kirim email sertifikat vaksin tanggal 29 juli 8 september masuk email susah masuk alias penuh masuk selfie ktpudah kayak pinjol tau data presiden bocor	negative
bssn data bank indonesia bocor nyata desember 2021 httpstcolbtg0dy9wq	negative
solusi data bocor shaappppp	negative
ya bu jahat nih negara data privasi warga bocor sengaja jual	negative
lapor komandan andre marah data bobol rekening bocor terima lapor	negative
no 13 no surprise hayoloh data pnsnya bocor ingetinget upload pas isi sapk	negative
klik link get 2500 pakai email daftar takut data pribadi bocor ngeri ya uang taruh data pribadi bocor	negative
menyimpan rekam jejak sehat pribadi data bocor mending aman data programaplikasi perintah	negative
lu pakai fb twitter orang indonesia data lu bocor lu komplain	negative
data milik bssn duga bocor deep web	negative
mamam tuh data pribadi bocor blokir websitenya ra mutu kerja	negative
anggar segitu data bocor tanggung apa-apa hidup nikmat mewah persetan rakyat rugi	negative
duga data bocor bssn gandeng pse	negative
data bocor	negative
data bocor kemarin resin kali	negative
menteri komunikasi informasi mengerti teknologi komunikasi mangkanya bocor tangannyadata sim card bocor johnny plate masyarakat jaga nik masingmasing	negative
bilang ngelindungin data biar bocor wkwkwk	negative
data pribadi nasabah bocor jamin dana nasabah bocor	negative
respons pedas pakar jokowi bentuk tim khusus cegah data bocor	negative
isu database bocor bank jatim data nasabah aman via	negative
160 ribu data lamar kerja bocor salah anak usaha pertamina	negative
cari sd rumah banding iseng lihat review sd negeri almameter gue dulupengen review takut data pribadi bocor	negative
ironis lihat iklan g20 edisi informatika 40 fafifu edar acaraacara berita pagi minggu data rakyat bocor terangterangan diperjualbelikan apaapa	negative
ya data bu puan bocor wkwk	negative
remaja 19 tangkap data langgar optus bocor sms scam	negative
data terobos bocor audit sanksi audit sanksi laksana sesuai atur undangundang lindung data pribadi	negative
sok sok 40 data bocor mulu cokkkkk	negative
modal beli data kadung bocor pakai bahasa inggris bikin hati berbungabunga hahahaha kitu	negative
wkwkw tukad data pribadi ku bocor eh ya	negative
selamat negara open sourcedata kominfo bocor isi 13milyar data nomer handphonenik kakak	negative
kayak data bocor ekspedisi deh indak recently call merah gc	negative
data bpjs kes naker bocor minimal pakai kayak bigdata toko online deh	negative
ya jaga kalo nik dipercayain bocor thats your job secure our data haduuuhhhh	negative
incase goblok ya nderdata pribadi data gblh bocor	negative
before that tuktuk bilang kalo data ucup bocor gue kayak enggak bisa deh deh gofar bilang ucup pas gue kayak menangis	negative
kayak riskan kasih barang bekas data takut bocor hapus data direcovery kasih bekas	negative
lihat reaksi perintah kayak 2000 data bocor cuman kayak hacker muncul	negative
solusi data pribadi bocor rekening buka orang data bocor	negative
data pertamina bocor bpjs bocor tokopedia bocor alodoc bocor hedeh kayak gin ikn metaverse	negative
hai kak maaf ya nyaman kait kendala kakak alami yuk lengkap data dm biar yora bantu cek privasi aman ya tks yora	positive
gawat 6 juta data pasien milik kemenkes bocor	negative
doa ku kominfo regulator gigi tindak milik sistem bocor data pribadi sektor privat publik regulasi cuman tatanan daftar 0 action rugi rakyat contoh bocor tokopedia bpjs	negative
enggak jelas sumpah instansi diurusi data bocor kicep	negative
enggak mau ah takut bocor data nya	negative
duga bocor bsi data dana nasabah aman	positive
klausul rahasia data hello lu hidup dengar data bocor peduli lindung kartu sim dll	neutral
data indonesia murah ya wkwk renyah enggak ada harga gapapa ambil data kalo besok orang hilang nyata masuk korban human trafficking gegara data bocor kominfo tanggung	negative
selamat ulang jhonny plate moga umur sehat sayang data pribadi bocor duga kena doxing hacker bjorka pas ultah ke66	positive
uupdp sah marak data bocor orang tanggung data pribadi harga banget data salah orang manfaat uu pdp	negative
data bocor data bocor ken tukang tambal data bocor	negative
database bocor jual anggar masak jaga aman data	negative
kemarin mengaku bocor ngakunya bocor data rahasia denial	negative
aware kominfo aplikasi judi ijinin data bocor parah pas vaksin itukedua teman lo kontol	negative
kalo barang cod mesen ya bayar modus tipu kadang data alamat bocor dijadikan kayak gin nih	negative
wajib daftar nomer sim card no telpon pakai nik kakak memcegah spam nyata mala data bocor jual kalo gin aman ancam	negative
gue pikir nih bni bocor data asw nomor gue bocor data privasi nomor hp sebar sih kasih kalo fokus tuju kuras tuh tabung	negative
heh lu tukang scammer tipu ngespam komen ya ya scammer memakai bri ngechatt whatsapp data nasabah bocor bri	neutral
heran sih kali data pribadi bocor libat nik ktp retas cyber crime indonesia kayak nyantai nyantai kalo	negative
telusur bisnis kamis 19 data duga bocor rupa hasil registrasi ulang sim card unggah buah akun nama bjorka forum breachedto	positive
orang tau nomor toko nomor promosi kembang akun toko shopeeku please explain data bocor kah nomor seller muncul paket resi customer tolong nomor aneh 7 angka	negative
laku datainformasi sengaja bocor tingkat hilir 1 ubah password tingkat aman 2 password manager 3 ganti email provider amanbeda kalo bocor tingkat hulu 1 pasrah 2 doa	negative
populer money harga pertamax turbo dexlite pertamina dex turun miliar data sim card bocor kominfo bantah sumber bocor	negative
website judi approve steam dkk bayar pajak lohitu hibur game coba kepo banget detailtar kalo data cc bocor tanggung kah tri	negative
gawat chatgpt mengaku data kartu kredit bocor httpstcokrlil4x5q0	negative
2 prank inisemalem story orang-orang mengantri spbu tanggal 1 sept pertalite pantang pulang fulltank nyata siang data kominpo bocor data kakak nik no hp provider bocor sampel data 2 juta gratis	negative
woi kominfo tanggung data bocor kemren juta orang sebar data orang izin kena pidana kominfo nih	negative
mending mencari daftar kudu include ktp ragu kalo daftar website resmi no ktp bahaya banget ya data indonesia bocor ya takut bocor 2x	negative
bikin lapor data bocor bagaimanaatau infocc	negative
the hell rahasia data browsing orang bocor situs sambung internet lo miris bgtthe real rip privacy sih kalo gin ya pas banget alih sambung parno kalo nya retas bocor publik	negative
ya orang tua panik anak enggak mau ribet n transfer sejati data bocor kurir ke rumah anter barang	negative
era digital data pribadi rawan bocor kecuali langgan pln pegawai pln wajib jaga data pribadi langgan	negative
duh gampang banget data bocor kemarin pln indihome kah nambal bolong bolong	negative
ehac kemenkes vpnmentor salah situs ulas vpn publikasi temu bocor data database ehac kali 15 juli 2021 13 juta data duga bocor database ukur 2gb tanggulang bocor	negative
inna lillahi bocor claimed data jaga rahasia	negative
data bocor usut kabar data sebar teror situs judi online debt kolektor minjam anjing fc kakak dijadikan bungkus goreng kertas data vaksin dijadikan bungkus nasi uduk data rakyat	negative
alihalih laku remediasi langkahlangkah korektif cegah penyalahgunaan data sensitif bocor perintah nampaknya fokus kejar bobol data kejar maling kompleks belah	negative
data agen intel bin bocor sungguh indonesia saing dunia spionase	negative
mengomong big data 110jt situ ex tentara lambe turah tau data umbar bocor	negative
jargon revolusi mental benaran realisasi apa-apa mandiri negeri demokrasi data bocor suruh jaga cabe mahal suruh tanam beras mahal suruh diet nasi mantap jokowi	negative
meta bantah data whatsapp bocor jual online	negative
korban doxing bjorka deret jabat negara data bocor nama bjorka tuai perhati publik lantar klaim hasil bocor data pribadi httpstcopct856ztjr	negative
gue kena bocor tokopedia dumbsmash canvamudah2n data aman maklum rakyat jelata	negative
pesan hatihati sebar informasi sumber bareskrim cari laku kali sebar hoaks data milu 2024 bocor	negative
duli data bocor main sosmed awokwokwok	negative
data intel bocor data polisi bocor data apakabar	negative
people eh buru uninstall app data pribadi bocor loh also people post your blablabla photo ih lucu post aah	negative
bingung deh orang-orang komennya situ pola pikir beliau jabat issue kayak gin rakyat lagipula gue beliau kayak mengerti data pribadi tuh urgency bocor tuh	negative
data masyarakat bocor kominfo slebew kominfo	negative
gue korban data bocor bpjs gue nik dipakai orang bpjs gue gaaktif gue tegor mengurus haha hehe doang mirisss	negative
data bocor suruh jaga nik pakai fotokopi ktp konon e ktp anggar gede korup	negative
data bocor sms spamming lapor perintah cuman bot btw kontak person coba	negative
tri piring otp ganti lindung nik bocor data digital	negative
dont put your trust the government but the fact is we need them line up nya penuh sudut perintah doang nih coba bantu loh berita tim sus tangan data lu bocor myong lu sadar sih	negative
sangkut rahasia mohon percaya masyarakat hancur data medis bocor unsur sengaja	negative
kominfo tanggap rencana gugat bocor data bpjs sehat	negative
kalo bingungnapa akun2 hardcore nkri ngutukin kadroenz enggak ada ribut data bocormikir prens tau kalo data phishing peduli lindung dot compadahal asli dot id bau amis	negative
13 miliar data nomor ponsel indonesia bocor ecek klik baca httpstcodm52mbopwmokelahmungkin bocor logis sih 13 miliar data nomor ponsel duduk 272 juta arti 4 nomor duduk percaya	negative
5050 data user indihome bocor hacker data peduli lindung bocor nyantumin identitas apk permission pinjol huhu	negative
data langgan indihome duga bocor masuk situs gelap news bengkulu	negative
bbm sambo data rakyat bocor internet komnas hamperempuan pilih kasih hukum tajam tumpul korupor nyaleg hadehhh	negative
situ nya badan ojk awas pinjam sedia usaha digital non digital 1memastikan data user aman bocor 2memastikan suku bunga batas wajar 3memastikan service collect sop 4dll	negative
salut perintah as ngakui kalo data bocor kayak negara wakanda data bocor cari-cari alas mbulet wae koyok tae	negative
pas data bocor lu bilang data lu bilang kalo atur biar aman lu amanin cuy kalo data digantiin anak lu jaga anak kalo anak tinggal lu	negative
berita teknologi layan premium snapchat resmi luncur data email opensea bocor httpstcowa3o3owdxt	negative
kasihan kemarin data telkomsel nya bocorbikin mewek mengadu bareynah lo ngamuk data rumah lo obralsadar ya nyetrezim bentar hidup lo tenangawas amfal	negative
kominfo selidik viralnya 13 miliar data sim card duga bocor jual pasar gelap	negative
bilang data bocor lo selesai lo wajib kasih data data bocor dasar ente suka ngandi ente nih kadang ngotak cc	negative
mengoceh alternatif alternatif data bocor lu apa-apa kominfo membedakan judi game sok-sokan bikin alternatif ganti steam mimpi jauh2 paham sok-sokan memyediakan alternatif pemgganti	negative
asuuuu bocor data pentinng anjinggg	negative
ya data bocor kalo ngelamar	negative
bahaya data bocor langgar privasi risiko manipulasi data rem sih	negative
kalo startup gede mah jamin sih data costumer nya kalo bocor salah konsumen menuntut uu nya	negative
pakai apps web bocor data nya min	negative
indonesian police data leaksebanyak 188000 data polisi bocorga jualtapi gratis katanyasaya pikir linux open source nyata indonesia jgselain data polisidata tokped indihome kenasc httpstcovg9vwgab0z	negative
korban data bocor kominfo toke	negative
sisi tuju aman data diseriusin data bocor solusi keminfo blok website jual data	negative
mjb nih dana nih aman nya pakai nik gue takut data pribadi bocor bahaya	negative
wkwkwk data bocor dibiarkan hadeeh	negative
iya bang gua sadar data data bocor booster orang petinggi	negative
masyarakat jaga data masyarakat bocor mengaco banget nih logika pikir	negative
halo tolong lacak akun nya pesan fake terima data bocor	negative
telkom komitmen jamin aman data langgan sok info data bocor hoax telkom valid	negative
13 miliar data daftar kartu sim telepon duga bocor	negative
spam sms whatsapp nomor menawari slot judi credit etc gadiurusin data pribadi orang bobol security lemah nik jokowi bocor kayak dianggep remehgapedulian dunno	negative
2016 bikin diskusi jamin aman data registrasi sim wajib diketawain dinyinyirin data bocor ngeles doa	negative
awas putin ngamuk data pentagon bocor nato masuk ukraina	negative
bocor data 13 miliar registrasi nomor hp kemenkominfo jual situs breached forum rp742 juta	negative
laahhhh lu spill data sianies bocor sih lu pea membuktikan gue pantengin kompas coba kasih gue lumayan gue wa selamat istirahat anies gece	negative
mbesok memilih menteri masak menjaga nik data nik bocor	negative
duh gawat data polisi lapor bocor	negative
data bocor mulu suruh pakai balut gih	negative
habis periksa email httpstcopqcrrjsl3a bisabisanya data email gue bocor salah platform	negative
duga data pribadi bank bsi bocor bertanghung tuips	negative
data 6 juta pasien covid19 milik kemenkes duga bocor jual forum gelap raid forums kamis 61	negative
stop being an idiot data bocor tugas kominfodi pp 71 2019 hadap serang siber leading sector domain tugas pokok fungsi	negative
data privasi bajak orang pse beda steam dll blokir jamin data jarang temu berita data pribadi steam bocor	negative
data mypertamina bocor pakar siber investigasi forensik digital bentuk komisi pdp	negative
bocor data masuk uang bocor sni	negative
data pribadi bocor orang telpon korban scam kartu kredit	negative
jaga rahasia data pribadi laku bocor data pribadi data bocor	negative
awoakwoakwok data bocor	negative
347gb data 2100 usaha indonesia bocor salah pln data isi id langgan alamat batas daya dll usaha data milik usaha direksi komisaris npwp pegang saham dll jual dark web rp743jt rp	negative
tuh data bocor lu mengomongkan sistem elektronik sistem maksud ngeles entar susah ngejelasinnya just sayang lu are gaptek and does not understand a thing about cyber securityyyyyyyyyy aaaaaaaaaaaaaaaaaa	negative
yll fc kakak indak takut data sebar uu pdp lho kalo bocor tuntut	negative
untung mama kirim nomor rekening isi form fishy sih aneh banget data bocor gobiznya aktifin	negative
pecah rekor negara jenis data bocor kah negara wkwkanda ah elah	negative
biarkan sangkut statemen kalo data pribadi bocor enggak apa-apa	negative
data bsi bocor lockbit duga uang tebus rp295 6 miliarsudirmancup2023 bank bsi erdoganbaca	negative
data rahasia kalo jabat negara istri 2 selingkuh teh kalo bocor panik kayak tuh heheh	negative
sih nih data norek bocor rem	negative
rampung 13 miliar data daftar kartu sim bocor muncul duga bocor data pns data sifat pribadi	negative
gempar 13 miliar data kartu sim bocor menkominfo audit httpstcodgazvnnh3v bal kapolri tolong periksa menteri kominfo janggal	negative
data kpu bocor nik kominfo bocor bocor bocor bocor tanggung	negative
alfons tanujaya lihat data bocor rupa data vendor korespondensi jasa marga	neutral
data pribadi bocor kayak pas marketplace bank perintah bpjs ya kayak berita	negative
mantan kaba sanksi institusi kumpul data bocor	negative
perintah tanggap serius nihberarti data bocor	negative
wkwkwkwk data mah bocor usaha jaga bocor	negative
database isu bocor bank jatim data nasabah aman	negative
iya sih kalo serang siber bssn laksana kemen salah kali data bocor regulator lolosin uu pdp mengatur 3rd party simpan data sensitif aman kencengin blokir mulu	negative
ancam data pribadi bocor erick thohir ajak ahli digital retas lokal lindung ri httpstcoximmcpvahm	negative
lamalama data bocor kayak canda deh dit wkwkwkw banget	negative
data bocor sebentar kelas 12	negative
data tokped bocor ya nya kemarin belanja tokped langsung nomer nelp mngatasanamakan tokped barang beli hmm	negative
syukur data bocor	negative
pakai vpn data bocor	negative
bisa2nya data lord tuan agung bocor wwkwk	negative
duga data sim card bocor opsel kompak bilang aman	negative
moga benar-benar hoax httpstcoeiqiout48iramai kabar data bocor bin hoaks	negative
data pernahterlanjur bocor laku langkahlangkah ya netizen asyik	negative
tuju kak data share aplikasi data disalahgunakan bukti deh kali curi data tmsk kena imbas data bocor sindikat	negative
