please daftar akun website patroli siber laporannnn data pribadi bocor orang tanggung pakai data pinjol diterorrr	negative
kayak data bocor zaman fotokopi kilo diloakin zaman digital parah mudah bobol kalo operator orang idiot	negative
data bocor prediksi gimananya serbaserbi mmc data pribadi retas	negative
kalo kayak gin nomor lu sebar orang jail data pribadi lu bocor gue mending ganti nomor takut parah jamin pinjol	negative
mall vaksin ketemu mbak henius gegara data user bocor big no banget pakai henius	negative
ya heran data bocor	negative
total size data customer indihome bocor 16 gbtidak tau	negative
bocor data valid langkah tampik data memberitahu sumber ayo benah	negative
data bank indonesia duga bocor polri ajar bareskrim	negative
simpan username password browser bahaya lho browser hack data bocor	negative
uninstall shopee data ku deh bocor	negative
menonton tutorial akses data open source kayak data negara bocor	negative
chip aplikasi deteksi scan barcode data bocor jual belikan kemarin kayak berita data aplikasi bocorr	negative
13 miliar data daftar kartu sim telepon duga bocor	negative
jalan data rakyat bocor publish coba bobol buka orang jangan-jangan bank data ktp kakak indonesia servernya	negative
data masyarakat bocor sabar yadata perintah	negative
data pribadi rawan bocor system lemah lengah	negative
bocor data pribadi nik no hp alamat suruh ganti password bubar mending	negative
kemarin duga data pasien bocor reaksi emma watson foto reuni	negative
data bocor uang wkwkw gopay mas	negative
juta data nomor seluler bocor forum breached kominfo angkat bicara	negative
alih isu data bocor	negative
data bocor kemarin datadata pribadi bocor deh capek memikirkan	negative
data bin bocor lucu kawan kerja bin mengaku kerja situ kantor bin daerah plang	negative
nyata tau steam mikir mikir daftarin enggak mau data pribadi customernya bocor mantap sih indonesia	negative
minyak turun 80usd oiiii bego pertamina turunin harga cepat data bocor blok sok2x an kerja pakai data	negative
data sim card bocor suruh rakyat jaga nik salah mengapai suruh suruh registrasi sim card pakai nik gue tuju putus why timbul bocor data sim card salahkan rakyat	negative
data langgan indihome duga bocor telkom group buka suara	negative
risiko akibat data pasien rs bocorselengkapnya	negative
keburu ditembokin nama agen krusial smhdata sih tebus moga benaran bocor data agen strategis ya pakk	negative
cerita enggak tau data bocor kasih solusi geuchik geuchik gerai kesdam nyata bocor data orang cewek belah data bochor	negative
mengurus data bocor eh bikin tanding google	negative
dungu data 13 b bocor gin	negative
wkwk kerja ngeblokirin doang sih ya mending urus data bocor kuat data aman	negative
kelas data bpjs sim card kandung data nik bocor wajib kominfo jaga nyiapin kesiap aman evoting milu milu nyoblos curang tiao daerah	negative
mbak kayak tinggal indonesia data perintah bocor via menteri usaha menteri	negative
pls kemarin ngisi bensin kayak apaapa mahal data bocor kriminal manamana sedih apas hhh	negative
26 juta data langgan indihome bocor telkom jual data pribadihttpstcosq7cgdacozdan lot knapa banget lot ya parah	negative
data bocor hacker bjorka fakta	negative
mohon aneh-aneh urus data vaksin bocor	negative
mikir salam concern banget politik indonesia data bocor real asli	negative
marahkrn data rakyat bocor	negative
install butuh krl awal-awal ragu takut data nya bocor dll heran gin negara aing deh ckckckck	negative
bocor data meresahkanada opsel laku laku aktivasi sim card daftar nik kakak system security is not save jamin data user opsel bocor	negative
kasih tau jgp awas data pribadi orang-orang data pribadi jabat negara bocor	negative
data personel bin duga bocor bin hoaks httpstcomghoziupeq via	negative
bocor data indonesia bocor data pribadi sektor swasta lembaga negara alhasil datadata bocor diperjualbelikan dunia maya	negative
kominfo tugas data sim card bocor mengurusi tanggungjawab kominfo hayo bikin atur sim card wajib daftar pakai nik hayo kalo kominfo kalo data sim card rakyat bocor ya kudu tanggungjawab bikin atur	negative
seuatu data bocor djp laku coba jelasin sopnyajangan bilang jaminsaat nikah suami istri janji seengga2nya harta 2	negative
ya ya kelas profesor wadaw sikan but respect sik iso ngetuti kembang zaman bedo karo dosen seng nde kene prof hormat data data e indonesia bpjs ektp vaksin wing jebol lo iki dicollect nde pse bukane ngko bocor kbh	negative
bang bang orang beli data bocor	negative
lindung data duduk bocor mengerti tanggulang	negative
bocor data nasabah bank jatim duga jual rp 352 miliar ahli forensik digital	neutral
watermark kirim data pribadi orang biar kalo bocor usul bocor ngehindarin bobol data	negative
bpjs sehat data kpai duga bocor jual bebas situs online	negative
saking semangate perang kesleo drijine kedistrak isu data bocor bhahaha	negative
17 juta data langgan duga bocor pln laku investigasi baca httpstcocrye1c6wjq	positive
oknum mengaku data polri bocor jual forum hacker	negative
data pimpin negara bocor hackerdi tanda tahan indonesia lemahpara buzerp suara nyaapa kah	negative
faktor security masuk compliencenya kominfo membiarkan data domain perintah bocor deh	negative
mengidolakanwarga muak kebijakan2 perintah acapkali ngasal rugi warganyadata warga bocor bukti kerja perintah serap anggar bukti ngasal cerobohdlm warga lampias kesal perintah	negative
heran berkali2 data bocor gin diam	negative
marak data bocor pesan stop being naiveterhadap serang siber leading sector domain tugas pokok fungsi	negative
data bocor pilih	negative
ah kayak data bom bocor spam iklan pinjol laknat chat judi online noh buanyak sekaleee urus vpn tutorial buka situs blokir vpn	negative
jaman data medsos bocor yawhatsapp is a privacy app keluarga tementemen tau nomor gue chat aneh kemarin pagi nomor asing chat gue salam doang	negative
perintah apaapa data bocor bikin data open source utama data jabat tolong kabar ya	negative
heker heker heker gua orang kemenkes sengaja jual tinggal kambing hitam heker data bocor bilang heker heker heker orang jual data biar dalem tuh kantong memek	negative
kemarin konser dekade noah data indihome bocor	negative
ratus diblock ribu apam wa akibat data bocor	negative
ponsel merk xiomi chinainipun bocor data chinabocor yahudi malaysia sajasgp resah	negative
data bocor bbm lengkap banget ngentot	negative
13 miliar data sim card bocor urus slebew hadehh kominfo kominfo	negative
wajar jabat ganggu usik edar data media sosial menkopolhukam data negara bocor jabat rezim ban nyata prof mahfud md	negative
asli cc bri chat nipu2 aman data aman banget smswa telfon nipu data bocor parah tipu kartu cc tau alamat detail kena tipu cs benaran	negative
sih ditelp orang random menawari asuransi dsj penipuitu data bocor jual usaha oknum karyawannydi wakanda data customer harga bungkus goreng	negative
data pilih goreng data hasil milu 2024mengesankan kpu rekayasa milu 2024 rena hasil bocorini goreng bahaya sih	negative
data ktp bocor banget anjeeerrrr	negative
kominfo catat 47 retas data bocor 2019 hacker bidik ecommerce instansi perintah	negative
13 miliar data sim card duga bocor simak 3 cek aman ponsel	negative
kalo bikin bijak data duduk bocor	negative
menkominfo tau data rakyat bocor	negative
bocor data pribadi nahas kali timpa polisi duga ribu data anggota polisi bocor gratis internet	negative
bocor data hubung simcard data simcard perintah regitrasi simcard pakai ktp paksa kirim data data percaya	negative
tipu gin data data bocor bpjs kayak download aplikasi klik taut website bpjs download my pertamina my my tuh sms spam gin	negative
bocor server data gambarsprite	negative
koreksi aplikasi nambahnambahin fitur data rawan bocor begayaan qris qris an	negative
ppkm cabut mesti paket pl malas banget aseli pakai apps kalo data warga bocor	negative
data bocor internet resiko internet bijak salah bocor data pribadi sendiriyuk simak tips jaga aman data aplikasiinternet	negative
mengapai sedih buang buang energi data bocor ya data menteri bocor	negative
efek data bocor manfaatin pinjol imf nih	negative
chap chip chap chip data pribadi presiden noh bocorktp chip nya fotocopy ktp	neutral
data bocor kayak benaran	negative
bocor data jahat siber cerdas aman lemah data bocor internet cont	negative
registrasi kartu perdana wajib input nik kakak data nik bocor masyarakat suruh jaga nik sendiriektp diphotocopy elektronik	negative
jhony stop main game uler tetris tanggung kalo data presiden bocor lho	negative
data apasih bocorkesebar negara wakanda	negative
data bocor bjorka bocorin banyaaak	negative
menteri kayak kalimenkominfo masyarakat jaga nik data kartu sim bocor httpstcoccpcirk1sq via	negative
rugi sidang nutupi data bocor orang-orang siapajadi tuh benar-benar losing game 2 orang korban negosiasi bocor tuh	negative
data nasabah bocor pemberitahuan bahas bsi	negative
johnny aneh masyarakat mengeluelukan bjorka aneh data benaran terusterusan bocor narasi daily	negative
ya ngisi2 gform no hp tuh rawan banget bocor data	negative
data identitas bocor parpol mesti laku halal	negative
data bocor hoaks kominfo ajak cisco kuat digital indonesia	negative
data bocor resi ya prof dampak rakyat	negative
rt pdrmsia akhbar pilih enam punca data peribadi bocor jpdphttpstcobrv6fuhbdk	negative
akun palsu kak nama kiki aman data pribadi bocor kak	negative
orang namai gue kontak pakai tanggal lahir aneh banget bikin data gue bocor	negative
lindung data kayak lindung tau kemarin data pilih kpu bocor jual forum hacker data duga akses bebas sih hacker cuman tinggal ngambil doang negara tinggal	negative
malas baca video nya brokebangetan kalo berita lanjur viral bikin gempar kemarin luruskandata registrasi sim card bocor threads kemarin cupu bagak suhuhoax	negative
calon bocor data orang kemanamana	negative
fyi kak kemarin dgr2 info data ecommerce bocor sibiru data alamat simpan dipakai oknum kirim paket cod bayar mengecek paket kena kak better ganti passwordbuat akun	negative
24 jam 2 wa tipu data nih bocor	negative
halah deh mengurus data bocor sik gena	negative
kalo pakai shopeepaylatertapi 2020 ujug2 didatangi dc kredivokatanya utang token listrik namaalamatkueh pas dcnya lihat langsung ngomongyah bedaterus dijelasin data ktp kayaknya bocor pas milu dipakai pinjol	negative
wapres titip menteri titip par tahi harap kerja bagus ngancurin bangsa negara menghilangkan bukti pakai kubur data bocor dianggep lumrah anggar negara kemanaemang nih negeri tarakarta	negative
bikin ksl tuh minjem tbtb tagih anjir data bocor kayak creepy banget gaksi	negative
asli ganti hp data bocor boros banget buka twitter whatsapp facebookini sih matiin aplikasi jalan layar	negative
data bocor ya ganti nomer hp mobile banking nya loh tlpn orang asing bank wa nomer tolong	negative
gila kwkwkwwk bocor data informasi sih tri keokminfo	negative
pln data langgan indihome bocor sih bocor melulu	negative
data vaksin bocor ya	negative
hehe bayangkan data orang dipakai pinjol data bocor	negative
data bocor telepon wa kode otpnya kode tbtb uang diatm hilang mutasi tari tanggung bri menunggu hasil uang tari lumayan	negative
data bocor unt milu ktp sera truk guling deh uninstall sehat arep nyengkeram rakyat masuk data pribadi	negative
hah data data siswa bocor	negative
okaay data bocor wangi pilih ronde post jam 2129 ya	negative
kelas presiden turun tangan langsung bocor data sayang akun takedown team khususapakah takut bukti bocor	negative
jaga daulat negara data warga negara bocor kemanamana	negative
anjing gue mimpi email gue dihack eh benaran data bocor	negative
baca psenya pengaruh bang pasar indonesia pse nya ku steam pajak kait data user keminfo protect data tuh bocor	negative
enggak tau nad bingung gue data bocor ya buka panik main nad alamat doang ya diisengin bayar nad paket	negative
sumpah rem loh data pribadi bocor gue baca akun salah buka website enkripsi gembok pakai wifi publik	negative
mas baca bijak privasi situs muncul pertanyaan2 nih httpstcovaupfncjsa aman data bocor malas baca sih	negative
min data bocor vaksin kubur nge vaksin mayat ngawur banget	negative
iya khawatir data bocor jual marketplace data ktp gin	negative
sebel data bocor neng doi ngebocorin tinggal menunggu sosok spill	negative
data bocor pikir deh map lamar kerja terima buang fc kakak dll buang bungkus nasi bungkus goreng dll panik	negative
bbm data pribadi bocor era buzzerrp rawan seru 3 periode data bocor sanksi kumpul data pribadi 5 bocor 3 periode ndasmu	negative
data badan intelijen negara bocor tanggap juru bicara bin	negative
cia tuh sih confidentality sistem jaga data simpan biar bocor i intergrity sistem jaga data biar pas transfer ubah a availability sistem data simpan akses darimana	negative
gauyzzz heker jago nama strovian ngatian bin idiot makan inikok bin elak bocor data bocor bos bin edar tik tok	negative
zaman merah data bocor ya	negative
heboh data intel bocor jubir bin hoaks	negative
data nasabah bank jatim duga bocor diperjualbelikan forum hacker harga usd 250 ribu rp 35 miliar johnny plate	positive
nik aktifasi kartu perdana seluler perintah data kasih perintah otomatis simpan data perintah pas data bocor nyuruh jaga nik dungu sinting	negative
hahaaabjorka mempan data bocor korban akun mati	negative
gapapa sih tinggal indonesia data bocor gais	negative
tau tuh dianggep data bocor wkwk cerita produk rilis tau dluan	negative
data bocorcovid19 real	negative
miliar data nomor hp nik bocor kemendagri bantah bobol hacker	negative
tolong bantu masyarakat sms masuk hp tolong tertib data bocor oknum2 polisi berantas jawa	negative
13 miliar data kemenkumham bocor 83k negatif indonesia moga	negative
hahaha jamin cuci tangan pas akibat data pribadi sim card bocor	negative
berita minggu bunuh brigadir bikin snewen bbm data bocorgue capek	negative
bobol 102 juta data kemensos bocor nik ktp httpstco0f6ttfrqvv bjorka anteraja mabuk ning imaz tete effendi simbolon	negative
jangan-jangan data lu bocor	negative
data bocor heran sih ngechat tuh berani banget whatsapp	negative
app peduli lindung tanggung data bocor lokasi vaksin pindah kasih tau sampah	negative
tau sih boart blacklist data artis bocor	negative
data nik bocor kominfo ledek hacker dpr malu	negative
pengin negara maju susah warga data warga bocor aman	negative
sih kalo data bocor komisaris direksi gaji	negative
data peduli lindung bocor wa pinjol wa leasing	neutral
kait sila konfirmasi potong pph 21 kerja data sesuai npwp kakak22 tkstopa	positive
sms tipu data hp orang bindo bocor	negative
spam telp tipu bnl parah tau nama lengkap kacau banget kalo data bocor	negative
goblok gapapa data bocor gapapa mengomong kasar iman tuhan maha esa	negative
negara data lembaga usaha bocor mengaku mengaku heran deh website bssn dideface halaman public relation	negative
bodoh banget nya nglakuin 2016 views nya 10 orang komentar 2 orangyg asli forum jm anti nohh 1k album nya sabotase jm data peibadi nya bocor perushaan nyuri dokumen cicil bayar aparteman jimin stan fitnah sabotae	negative
data nik gampang bocor situs judi bebas rajalela pegang kominfo dukcapil nope nope nope	negative
pse pse tahi anjing ujung-ujung nya data pribadi bocor kerja mengapai sih	negative
maybank nih susah sikit data orang nak bocor sistem boek data orang bocor debt collectors je data orang seludup data lepas jual	negative
jiga data bocor	negative
minyak langka rakyat suruh ngerebus data pribadi bocor rakyat rutin ganti password bbm rakyat suruh hemat problem solved nope	negative
edar informasi media sosial 26730797 data histori browsing langgan indihome bocor masuk kartu tanda duduk ktp email nomor ponsel kunci domain platform url	negative
kak chat orang kenal tuju pinjam tuju sengaja klik link taut nya pakai pinjol pinjol konto data pribadi bocor ktp pakai orang konto saran kak	negative
teruuus bri komitmen tekan proteksi kuat hadap data nasabah infrastruktur lindung loh tuh data nasabah bocor benaran prioritasin nasabah banget	positive
era digital data milik harga sebar arti peluang nikmat barang milik	positive
data bocor data nasabah aman	negative
exactly kasih data lengkap tanggung kalo data2 bocor ya coba deh	negative
pilot ya iya lho tau iya data keluarga bocor internetdata kominfo bocor	negative
ngelindungin data bocor	negative
data 15 miliar facebook kabar bocor jual internet	negative
data kipk bocor	negative
idol susah nder mending bebas diikutin bebas data pribadi bocor	negative
paham ya isu data langgan bocor makah blokar blokir	negative
ngelive 6 jam bocor paket data anjir wkwk 10 menit cuman nyuting ikan bakar bangkai	negative
awas bocor data nya kak bahaya share2 medsos	negative
samsung data konsumen bocor retas	negative
pt telkom konfirmasi bocor datadata langgan indihome valid selidik ya datadata bocor selidik masyarakat utama langgan tenang	positive
anjir anjir capek gue serah kopingmo deh data bocor hshshankq	negative
komunikatif kalo tarif promo rayu gombal hapus eh data langgan bocor yoook masuk instansi tahap testtesttest bisaaaa data langgan bocor	negative
bocor data nomor duduk faedah coba berfikiran logis data bocor manfaat	negative
500 juta data bocor whatsapp buka suara	negative
ektp suruh fotokopi data duduk kadang suka bocor proyek metaverse fokus aneh	negative
4 bahaya data pribadi bocor httpstcobullsufs4g	negative
norak tggu entar bocor tuh pictrus menuduh kalo hoax orang bocor data negaramakan taiii	negative
data pribadi masyarakat nik npwp bocor dengar aspirasi rakyat	negative
data bocor suruh jaga nik	negative
ngomong2 data aman vaksin data2 pfizer bocor ptun	negative
bilang bjorka16 gue mah mending buka tokobeli sawah empanglagian data bocor mah kudu lagiwkwkwkw	negative
polisi ya tau iya data keluarga bocor internet	negative
website daftar pse arti tunduk bijak indonesia arti sistem aman website sangkut pegang kominfo data website bocor salah kominfo konsep	negative
aset akses kerja sifat confidental situ data data sifat pribadi critical situ susah kasih pacar nanggung resiko bocor data repot	negative
hai joki pinjol banget ya khawatir data bocor trik rahasia penasarann yuk langsung dm yaapp	positive
ya pecat oknum model gin ya 1 2 mengerti data bocor	negative
data bocor teman daftarin nomer slot qntl	negative
mengapai ajg lu mending benerin tingkat aman lu puluh ribuagi data bocor kakak dijadikan bungkus goreng menyalahkan warga tololsori emosi gelar lapak	negative
kemarin data kemenkes bocor jual kedengaran	negative
alas aman informasi user anjer mah wajib developer kali jagaanjing banget sumpah data bocor tanggung seengganya bantu diam otw komunis ver beta anjir mah	negative
hati-hati ktp palsu data bocor mah ngeri ktp ngambil data bocor rem	negative
tulis alamat surel nomor telepon kolom telusur cybernews lapor data bocor kait alamat surel nomor telepon	negative
kayak barusan alami heran kena tipu lapor aman2 ya cari korban selanjutnyamasalahnya arti data bank akun bocor bri diam ya	negative
kominfo lu gilir data pribadi bocor diam anying	negative
bocor data atur hacker buzzer kalo gaduh hasil kpu 2014 2019 harun mas dimana korupsi dana bansos cair rekening jiwasraya masuk kemana rekening nya transfer uang buzzer katrok ah	negative
13 miliar data sim card duga bocor forum gelap kominfo bantah	negative
aseeemmm banget deh data sehat bocor	negative
mengomong data negara bocor kertas goreng anak pus ajar arsip bunda arsip jadwal retensi terap ngawang data dihack canggih hehe	negative
kemarin menonton drakor attorney woo penasaran data publik bocor gin tuntut	negative
data nasabah bank jatim duga bocor	negative
data info bocor wikileaks ya ngaruh2 sih bocor situs perintah	negative
lu kalo gaji pakai pajak gue setor negara kerja anjing data lu bocor nihhhhh salah nih data gue duitt lu pakai menafkahi anak biniiii lu pajak guaaaaa	negative
cek data registrasi nomor ponsel masuk 13 miliar data bocor	negative
bpjs data kpai duga bocor jual raidforums	negative
data pribadi bocor data pribadi lapor	negative
akibat menyimpan data pakai kantong plastik gampang bocor	negative
data lanjur bocor mencari celah bocor dimana main blokar blokir doang	negative
riskan kelola aman data pribadi aplikasi ojoltaxi onlinelogical error contoh real ehac bocor prtanggungjawbn menkesnya suruh uninstallkelola data pribadi kesan cobacoba	negative
data registrasi sim card prabayar bocor susul erick thohir singgung 60 juta data pedulilindungi hilang	negative
gampang sih data masyarakat bocor ktp bpjs dll percaya undangundang rubah rubah ekspose publik sembunyi	negative
orisinal banten sorot data pribadi 815 guru kabupaten tangerang bocor	negative
data ktp suka bocor	negative
halo becus kerja malu suruh jaga data ganti password situ bobol database pakai apas keman jaring pakai firewall pakai gobk banget data gue bocor wa tau nama lengkap asli spam chat sms	negative
masuk data sampel masuk 13 miliar data bocor	negative
8 denny ledek datadatanya bocor bjorka data bocor lantas tantang bjorka bocor data chat mesum rizieq firza	negative
data negara bocor kutip lengkap kalimat prof mahfud lansir inews bocor data hehehe data negara lapor bssn analisis deputi kerja	negative
data rahasia bocor	negative
kacau kayak solusi biar data bocor ganti password	negative
lama-lama banget data bocor	negative
layan adu kpai ganggu data bocor httpstco1ochln38eu	negative
bocor data weee	negative
nomor pascabayar dipakai 2006 keluarga dkt urusan2 bank tabung cc akhir2 banget wa spam masuk kalo bocor operator curiga bank nya nih bikin datanomor bocor wtf	negative
data deh bocor apps covid scammer judi online scammer jnt barang pickup scammer barang order kena tax aia insurance claims bodoh jer	negative
godaddy sasar hacker juta data wordpress bocor httpstcodhmtcvpmum	negative
hah data pribadi bocor awas ulah oknum bertanggungjawab manfaat informasi pribadi marak bocor data lho	negative
mohon mahfud md bocor data ktp sim card email bahaya tanganin serius mr bjorka orang fake mr bjorka hyker indonesia bocil bocil manfaatin data privasi pinjol traskasi uang putar pakai mobil banking bocor	negative
wahahaha tau tuh data bocor manamana	negative
data rakyat indonesia bocor jual bebas jajar aman siber indonesia kerja maksimal	negative
sistem bank kuat bobol gua sistem aman bank sistem aman negara kait bank data nasabah absah kalo ke3 mudah bocor ya rekening nasabah mudah jebol	negative
lucu ya bocor data cpns nya libat cuman doang pns obnya	negative
data 54 juta akun twitter bocor	negative
hoalah penasaran deh data bocor ya	negative
kalo tau institusi nim nama lengkapnama lengkap masuk data pribadi iya orang nganggep nama lengkap data sensitifkalo nim nama mencari sisa susah notabene lindung data lemah bocor	negative
gilir data elite bocor panik pas kemarin data rakyat bocor suruh jaga masingmasing rakyat lindung haha	negative
negara tuh fokus tegur lembaga organisasi usaha kumpul data masyarakat big data data bocorjangan fokus kejar hacker hantu blau rimba	negative
13 miliar data sim card ri duga bocor nik nomor hp	negative
data pasien covid19 bocor indonesia juluk salah netizennya negara open source habis baca komentar artikel muncul line today	negative
data gue bocor bsi tebus lockbit gue pakai bsi	negative
data bocor data nasi bungkus	negative
telepon bawarin asuransi salon kartu kredit fix data bocor	negative
nih data bos kerja bocor	negative
data client bocor ngeri nih kecimpung dunia ent auto cancelled	negative
data bocor jenderal bunuh bbm rusa lingkung oligarki yawooh	negative
menteri sehat nyata telusur duga data pasien server bocor jual forum gelap	negative
gadget pakar aman siber 4 data bocor httpstco9wyjqfg86x ahli aman siber forensik digital vaksincom alfons tanujaya tanggap kena data bocor httpstcoyy79jofjwt	negative
infra nya khawatir kelas sesko tni aneh kalo data bocor	negative
emil data pribadi masyarakat bocor salah data daftar partai politik kpu jarang data masyarakat jual beli daring	negative
kelas data bin bocor loh keun ari upi mah kampus security nya lemah data privasi rakyat coba lindung data rahasia negara sulit pindah negara we apply green card kitu	negative
makan pegawai biyuemen daftar bocor data	negative
yadahlaaah kalo data hani bocor pattern hp orang diajari gampang wkwkwk	negative
tolong ya nih no deh telepon no kagak pas cek nyata scamspam daftar cc kagak asuransi kagak data bocor ganggu banget elah	negative
replynya ya panik takut data orang pengaruh bocor orang kayak obat indonesia cekuaks asdasd	negative
sumpah parah banget daftar gobiz data bocor duit doang aman data parah gin	negative
website bas data milik perintah pikir kerja tampil web aman data bodoh industri digital 40 data bocor dimanamana	negative
bolakbalik mengomong data istilah wasweswos canggih nyata data bocor dijualin lihat langkah lindung ulang jual omong doang nyata oh sok jual	positive
kunci menang ya tiu kexurangan data hasil milu mengomongnya telat data bocor publik cerdas nya orang	negative
respon netizen indonesia a t a n ya a bocor data ya iya data bocor dukung wkwkwk	positive
orang orang panik bocor data pribadi gue berangkat kerja siang lampu lupa dinyalain panik nya ampun	negative
dokumen bin bocor tangan bjorka besok moga bocorin dalang bunuh munirsampe supersemarbiar sejarah indonesia data valid	negative
thanks simak data publik kelola instansi perintah bumn bocor bertanggungjawab pilih boarding manualgood luck with your new technology i ll stick the old one	negative
1 kali hacker klaim milik surat dokumen tuju presiden republik indonesia dokumen kepala negara bocor deep web aktor jahat nama bjorka	negative
kocak ya data intel bocor aneh ih	negative
bocor data bocor bikin gue enggak pernah menulis nama asli gue username bangga nama ya ery anggraeni rumah pemda cibinong	positive
slebew blokir gilir data rakyat bocor tanggung	negative
ribut data bocor korban kemarin2 arti seminar big data 40 bahas sekuriti data fafifu wasweswos belaka	negative
belanja online kait barang import data beli bocor negeri	negative
preeett jlas2 dbongkar e aplikasi kuntul nyebar plindungi bocor bocor data	negative
